242,luctus tincidunt nulla mollis molestie lorem quisque ut erat curabitur gravida nisi at nibh in hac habitasse platea dictumst,8,242,6
243,molestie lorem quisque ut erat curabitur gravida nisi at nibh in hac habitasse platea dictumst aliquam,15,243,13
244,mi sit amet lobortis sapien sapien non mi integer ac neque duis bibendum morbi non quam,1,244,16
245,imperdiet et commodo vulputate justo in blandit ultrices enim lorem ipsum dolor sit amet consectetuer,15,245,4
246,a suscipit nulla elit ac nulla sed vel enim sit amet,3,246,20
247,libero non mattis pulvinar nulla pede ullamcorper augue a suscipit nulla elit ac nulla,6,247,22
248,nam congue risus semper porta volutpat quam pede lobortis ligula sit,12,248,20
249,sit amet nulla quisque arcu libero rutrum ac lobortis vel dapibus at diam nam tristique tortor eu pede,7,249,8
250,magna vulputate luctus cum sociis natoque penatibus et magnis dis parturient montes nascetur ridiculus mus vivamus vestibulum sagittis sapien cum,6,250,10
251,ipsum integer a nibh in quis justo maecenas rhoncus aliquam lacus morbi quis tortor id,3,251,3
252,lectus in est risus auctor sed tristique in tempus sit amet sem fusce consequat,7,252,2
253,accumsan tellus nisi eu orci mauris lacinia sapien quis libero nullam sit amet turpis elementum ligula,5,253,3
254,eget semper rutrum nulla nunc purus phasellus in felis donec semper sapien a libero nam,12,254,17
255,pede justo lacinia eget tincidunt eget tempus vel pede morbi porttitor lorem id ligula suspendisse ornare consequat lectus,18,255,10
256,sapien ut nunc vestibulum ante ipsum primis in faucibus orci luctus et ultrices posuere cubilia curae mauris viverra diam vitae,1,256,17
257,ante ipsum primis in faucibus orci luctus et ultrices posuere,10,257,24
258,tincidunt eu felis fusce posuere felis sed lacus morbi sem mauris laoreet ut rhoncus aliquet,6,258,18
259,quis turpis eget elit sodales scelerisque mauris sit amet eros suspendisse accumsan tortor,12,259,11
260,odio porttitor id consequat in consequat ut nulla sed accumsan felis ut at dolor quis odio consequat varius integer ac,3,260,17
261,in lacus curabitur at ipsum ac tellus semper interdum mauris ullamcorper purus sit amet,14,261,10
262,mauris lacinia sapien quis libero nullam sit amet turpis elementum ligula,14,262,22
263,et ultrices posuere cubilia curae nulla dapibus dolor vel est donec odio,9,263,2
264,quisque erat eros viverra eget congue eget semper rutrum nulla nunc purus phasellus in felis donec semper sapien a libero,13,264,11
265,dictumst aliquam augue quam sollicitudin vitae consectetuer eget rutrum at lorem integer tincidunt ante,6,265,10
266,nulla integer pede justo lacinia eget tincidunt eget tempus vel pede morbi porttitor lorem id ligula suspendisse ornare consequat lectus,10,266,2
267,et commodo vulputate justo in blandit ultrices enim lorem ipsum,1,267,8
268,pede libero quis orci nullam molestie nibh in lectus pellentesque at nulla suspendisse potenti cras in purus eu,8,268,22
269,neque sapien placerat ante nulla justo aliquam quis turpis eget elit sodales scelerisque mauris sit amet,1,269,7
270,tristique est et tempus semper est quam pharetra magna ac consequat metus,15,270,9
271,platea dictumst morbi vestibulum velit id pretium iaculis diam erat,20,271,15
272,massa volutpat convallis morbi odio odio elementum eu interdum eu tincidunt in leo,8,272,1
273,cum sociis natoque penatibus et magnis dis parturient montes nascetur ridiculus mus etiam vel augue vestibulum rutrum rutrum neque aenean,11,273,10
274,justo sit amet sapien dignissim vestibulum vestibulum ante ipsum primis in faucibus orci luctus et ultrices posuere cubilia curae,18,274,18
275,augue vestibulum rutrum rutrum neque aenean auctor gravida sem praesent id massa id nisl venenatis lacinia aenean,6,275,2
276,mauris viverra diam vitae quam suspendisse potenti nullam porttitor lacus,14,276,25
277,vulputate luctus cum sociis natoque penatibus et magnis dis parturient montes nascetur ridiculus mus vivamus,6,277,10
278,tortor sollicitudin mi sit amet lobortis sapien sapien non mi integer ac neque duis bibendum morbi non,18,278,12
279,id nisl venenatis lacinia aenean sit amet justo morbi ut odio cras mi pede malesuada,7,279,3
280,fusce lacus purus aliquet at feugiat non pretium quis lectus suspendisse potenti in eleifend quam a odio in,11,280,12
281,turpis a pede posuere nonummy integer non velit donec diam neque vestibulum,8,281,19
282,volutpat eleifend donec ut dolor morbi vel lectus in quam fringilla rhoncus mauris enim leo rhoncus sed,15,282,20
283,a libero nam dui proin leo odio porttitor id consequat in,16,283,18
284,sapien cum sociis natoque penatibus et magnis dis parturient montes nascetur,9,284,1
285,rutrum neque aenean auctor gravida sem praesent id massa id nisl,15,285,25
286,justo nec condimentum neque sapien placerat ante nulla justo aliquam quis,14,286,5
287,congue risus semper porta volutpat quam pede lobortis ligula sit amet eleifend pede libero quis orci,3,287,13
288,eget rutrum at lorem integer tincidunt ante vel ipsum praesent,16,288,19
289,sit amet sapien dignissim vestibulum vestibulum ante ipsum primis in faucibus orci luctus et ultrices posuere,11,289,14
290,sapien varius ut blandit non interdum in ante vestibulum ante ipsum primis in faucibus orci,2,290,20
291,blandit nam nulla integer pede justo lacinia eget tincidunt eget tempus vel pede morbi,16,291,22
292,lectus suspendisse potenti in eleifend quam a odio in hac habitasse platea dictumst maecenas ut,3,292,22
293,quis augue luctus tincidunt nulla mollis molestie lorem quisque ut erat curabitur gravida nisi at nibh,12,293,10
294,vitae nisl aenean lectus pellentesque eget nunc donec quis orci eget orci vehicula,3,294,1
295,donec quis orci eget orci vehicula condimentum curabitur in libero ut massa volutpat convallis morbi odio odio elementum eu interdum,9,295,24
296,interdum eu tincidunt in leo maecenas pulvinar lobortis est phasellus sit amet erat nulla tempus vivamus in felis eu sapien,13,296,13
297,tristique in tempus sit amet sem fusce consequat nulla nisl nunc nisl duis bibendum felis sed interdum,1,297,19
298,mus etiam vel augue vestibulum rutrum rutrum neque aenean auctor gravida sem praesent id massa id,14,298,6
299,blandit nam nulla integer pede justo lacinia eget tincidunt eget tempus vel pede morbi porttitor lorem id ligula suspendisse,9,299,5
300,morbi ut odio cras mi pede malesuada in imperdiet et,14,300,6
301,nullam molestie nibh in lectus pellentesque at nulla suspendisse potenti cras in purus eu magna,7,301,6
302,nonummy integer non velit donec diam neque vestibulum eget vulputate ut ultrices vel augue vestibulum ante ipsum primis in,3,302,13
303,rutrum at lorem integer tincidunt ante vel ipsum praesent blandit lacinia erat vestibulum,13,303,7
304,donec semper sapien a libero nam dui proin leo odio porttitor id consequat in consequat ut nulla,6,304,23
305,consequat in consequat ut nulla sed accumsan felis ut at dolor quis odio,3,305,7
306,donec odio justo sollicitudin ut suscipit a feugiat et eros,13,306,15
307,fusce consequat nulla nisl nunc nisl duis bibendum felis sed interdum venenatis turpis enim blandit mi in porttitor pede justo,18,307,8
308,ligula suspendisse ornare consequat lectus in est risus auctor sed tristique in tempus sit,8,308,9
309,sed accumsan felis ut at dolor quis odio consequat varius integer ac leo pellentesque ultrices mattis odio donec,16,309,16
310,aliquet ultrices erat tortor sollicitudin mi sit amet lobortis sapien sapien non mi integer ac,5,310,15
311,volutpat erat quisque erat eros viverra eget congue eget semper rutrum nulla nunc purus phasellus in felis,3,311,22
312,sit amet erat nulla tempus vivamus in felis eu sapien cursus vestibulum proin eu mi nulla,3,312,3
313,maecenas ut massa quis augue luctus tincidunt nulla mollis molestie lorem quisque ut erat curabitur gravida,11,313,3
314,ligula sit amet eleifend pede libero quis orci nullam molestie nibh in lectus pellentesque at nulla suspendisse potenti cras,13,314,22
315,sed ante vivamus tortor duis mattis egestas metus aenean fermentum donec ut mauris eget,6,315,20
316,lorem vitae mattis nibh ligula nec sem duis aliquam convallis nunc proin,12,316,14
317,est lacinia nisi venenatis tristique fusce congue diam id ornare imperdiet sapien urna pretium nisl ut volutpat sapien,7,317,5
318,odio donec vitae nisi nam ultrices libero non mattis pulvinar,16,318,16
319,nibh ligula nec sem duis aliquam convallis nunc proin at,7,319,25
320,eu sapien cursus vestibulum proin eu mi nulla ac enim in tempor turpis,6,320,18
321,aliquam augue quam sollicitudin vitae consectetuer eget rutrum at lorem integer tincidunt,1,321,11
322,aliquet pulvinar sed nisl nunc rhoncus dui vel sem sed sagittis nam congue risus,12,322,23
323,dolor quis odio consequat varius integer ac leo pellentesque ultrices mattis odio,12,323,11
324,est risus auctor sed tristique in tempus sit amet sem fusce consequat nulla nisl nunc,1,324,19
325,a odio in hac habitasse platea dictumst maecenas ut massa quis augue luctus tincidunt nulla mollis molestie lorem,7,325,1
326,non quam nec dui luctus rutrum nulla tellus in sagittis dui vel nisl duis ac nibh fusce,14,326,8
327,curae donec pharetra magna vestibulum aliquet ultrices erat tortor sollicitudin mi sit amet lobortis sapien sapien,7,327,11
328,potenti nullam porttitor lacus at turpis donec posuere metus vitae,5,328,13
329,scelerisque quam turpis adipiscing lorem vitae mattis nibh ligula nec sem duis aliquam convallis,4,329,21
330,diam erat fermentum justo nec condimentum neque sapien placerat ante nulla justo aliquam quis turpis,17,330,23
331,semper est quam pharetra magna ac consequat metus sapien ut nunc vestibulum ante ipsum primis in faucibus,5,331,8
332,luctus ultricies eu nibh quisque id justo sit amet sapien dignissim vestibulum vestibulum ante ipsum primis in,12,332,8
333,sapien urna pretium nisl ut volutpat sapien arcu sed augue aliquam erat volutpat in congue etiam,3,333,24
334,fermentum donec ut mauris eget massa tempor convallis nulla neque libero convallis eget eleifend,2,334,25
335,vel ipsum praesent blandit lacinia erat vestibulum sed magna at,20,335,20
336,pede posuere nonummy integer non velit donec diam neque vestibulum eget vulputate ut ultrices vel augue,13,336,24
337,diam vitae quam suspendisse potenti nullam porttitor lacus at turpis donec posuere metus vitae ipsum aliquam non,1,337,2
338,tincidunt nulla mollis molestie lorem quisque ut erat curabitur gravida nisi at nibh in hac,6,338,22
339,ultrices libero non mattis pulvinar nulla pede ullamcorper augue a suscipit nulla elit ac nulla sed,7,339,1
340,vulputate luctus cum sociis natoque penatibus et magnis dis parturient montes nascetur ridiculus,2,340,7
341,eget eros elementum pellentesque quisque porta volutpat erat quisque erat eros,16,341,18
342,sed sagittis nam congue risus semper porta volutpat quam pede lobortis ligula sit,1,342,3
343,luctus rutrum nulla tellus in sagittis dui vel nisl duis ac nibh,13,343,11
344,tincidunt ante vel ipsum praesent blandit lacinia erat vestibulum sed magna at nunc commodo placerat praesent blandit nam nulla,17,344,7
345,morbi ut odio cras mi pede malesuada in imperdiet et,3,345,16
346,sit amet consectetuer adipiscing elit proin interdum mauris non ligula,18,346,14
347,malesuada in imperdiet et commodo vulputate justo in blandit ultrices enim,20,347,17
348,diam in magna bibendum imperdiet nullam orci pede venenatis non sodales sed tincidunt eu felis fusce,14,348,18
349,in ante vestibulum ante ipsum primis in faucibus orci luctus et ultrices posuere,4,349,9
350,massa donec dapibus duis at velit eu est congue elementum in hac habitasse platea dictumst,16,350,5
351,ut nunc vestibulum ante ipsum primis in faucibus orci luctus et ultrices posuere cubilia curae mauris viverra,14,351,18
352,eget vulputate ut ultrices vel augue vestibulum ante ipsum primis,19,352,19
353,pede ac diam cras pellentesque volutpat dui maecenas tristique est et tempus semper est quam pharetra magna ac consequat,10,353,2
354,augue vestibulum rutrum rutrum neque aenean auctor gravida sem praesent id massa id nisl venenatis,9,354,2
355,nisi venenatis tristique fusce congue diam id ornare imperdiet sapien,1,355,6
356,purus aliquet at feugiat non pretium quis lectus suspendisse potenti in eleifend quam a odio in hac habitasse platea,4,356,18
357,vulputate luctus cum sociis natoque penatibus et magnis dis parturient montes nascetur ridiculus mus vivamus vestibulum sagittis sapien,9,357,22
358,id pretium iaculis diam erat fermentum justo nec condimentum neque sapien placerat,2,358,15
359,magna at nunc commodo placerat praesent blandit nam nulla integer,4,359,3
360,nulla tellus in sagittis dui vel nisl duis ac nibh fusce lacus purus aliquet at feugiat non pretium,18,360,23
361,in libero ut massa volutpat convallis morbi odio odio elementum eu interdum eu tincidunt in leo maecenas pulvinar,6,361,20
362,dictumst maecenas ut massa quis augue luctus tincidunt nulla mollis,2,362,22
363,odio in hac habitasse platea dictumst maecenas ut massa quis augue luctus tincidunt nulla mollis,6,363,21
364,platea dictumst maecenas ut massa quis augue luctus tincidunt nulla,6,364,9
365,a feugiat et eros vestibulum ac est lacinia nisi venenatis tristique fusce congue diam id ornare,20,365,4
366,ultrices posuere cubilia curae duis faucibus accumsan odio curabitur convallis duis consequat dui nec,1,366,16
367,curabitur convallis duis consequat dui nec nisi volutpat eleifend donec ut dolor morbi vel lectus in quam fringilla rhoncus mauris,1,367,14
368,suspendisse accumsan tortor quis turpis sed ante vivamus tortor duis mattis egestas,1,368,3
369,ante ipsum primis in faucibus orci luctus et ultrices posuere cubilia curae nulla dapibus dolor,11,369,6
370,et magnis dis parturient montes nascetur ridiculus mus etiam vel augue vestibulum rutrum rutrum neque aenean auctor,20,370,8
371,pede libero quis orci nullam molestie nibh in lectus pellentesque at nulla suspendisse potenti cras in,9,371,6
372,consequat ut nulla sed accumsan felis ut at dolor quis odio,16,372,13
373,magna vestibulum aliquet ultrices erat tortor sollicitudin mi sit amet lobortis sapien,15,373,19
374,fusce lacus purus aliquet at feugiat non pretium quis lectus suspendisse potenti in eleifend quam a odio,6,374,2
375,suscipit nulla elit ac nulla sed vel enim sit amet nunc viverra dapibus nulla,20,375,8
376,in ante vestibulum ante ipsum primis in faucibus orci luctus et ultrices posuere cubilia curae duis faucibus accumsan,17,376,15
377,non quam nec dui luctus rutrum nulla tellus in sagittis dui vel nisl duis ac nibh,17,377,15
378,odio porttitor id consequat in consequat ut nulla sed accumsan felis ut at dolor,9,378,22
379,nulla integer pede justo lacinia eget tincidunt eget tempus vel pede morbi porttitor lorem,1,379,7
380,imperdiet sapien urna pretium nisl ut volutpat sapien arcu sed augue aliquam erat volutpat in congue,13,380,17
381,purus phasellus in felis donec semper sapien a libero nam dui,9,381,16
382,erat nulla tempus vivamus in felis eu sapien cursus vestibulum proin eu mi nulla ac enim in tempor,8,382,10
383,pretium quis lectus suspendisse potenti in eleifend quam a odio,19,383,13
384,nulla integer pede justo lacinia eget tincidunt eget tempus vel,1,384,23
385,est congue elementum in hac habitasse platea dictumst morbi vestibulum,9,385,15
386,elit sodales scelerisque mauris sit amet eros suspendisse accumsan tortor quis,13,386,8
387,nulla nunc purus phasellus in felis donec semper sapien a libero nam dui proin leo odio porttitor id consequat in,6,387,1
388,bibendum felis sed interdum venenatis turpis enim blandit mi in porttitor pede justo eu massa donec,12,388,9
389,sit amet lobortis sapien sapien non mi integer ac neque,20,389,23
390,eu orci mauris lacinia sapien quis libero nullam sit amet turpis elementum ligula vehicula consequat morbi a ipsum,20,390,19
391,aliquam quis turpis eget elit sodales scelerisque mauris sit amet eros suspendisse accumsan tortor quis turpis sed ante vivamus tortor,9,391,15
392,amet consectetuer adipiscing elit proin interdum mauris non ligula pellentesque ultrices phasellus id sapien in sapien iaculis,18,392,7
393,cursus urna ut tellus nulla ut erat id mauris vulputate elementum nullam varius nulla facilisi cras non,5,393,20
394,sed sagittis nam congue risus semper porta volutpat quam pede lobortis ligula sit amet,19,394,10
395,vitae ipsum aliquam non mauris morbi non lectus aliquam sit amet diam,1,395,13
396,odio odio elementum eu interdum eu tincidunt in leo maecenas pulvinar lobortis est phasellus sit amet erat nulla tempus,15,396,19
397,aliquam augue quam sollicitudin vitae consectetuer eget rutrum at lorem integer tincidunt ante vel ipsum praesent blandit lacinia,2,397,25
398,mauris enim leo rhoncus sed vestibulum sit amet cursus id turpis integer aliquet massa id,10,398,17
399,nibh fusce lacus purus aliquet at feugiat non pretium quis,8,399,18
400,nec nisi vulputate nonummy maecenas tincidunt lacus at velit vivamus vel nulla eget eros elementum pellentesque quisque porta volutpat,3,400,8
401,accumsan felis ut at dolor quis odio consequat varius integer ac leo pellentesque ultrices mattis odio donec vitae,2,401,9
402,sollicitudin mi sit amet lobortis sapien sapien non mi integer ac neque duis bibendum morbi non quam nec dui luctus,14,402,3
403,proin interdum mauris non ligula pellentesque ultrices phasellus id sapien in sapien iaculis congue vivamus metus arcu adipiscing molestie,1,403,21
404,vel accumsan tellus nisi eu orci mauris lacinia sapien quis libero nullam sit,8,404,18
405,id nisl venenatis lacinia aenean sit amet justo morbi ut odio cras mi pede malesuada in imperdiet et,5,405,18
406,eros suspendisse accumsan tortor quis turpis sed ante vivamus tortor duis mattis egestas metus aenean fermentum donec,20,406,19
407,quis odio consequat varius integer ac leo pellentesque ultrices mattis odio donec vitae nisi nam,17,407,20
408,luctus et ultrices posuere cubilia curae donec pharetra magna vestibulum aliquet ultrices erat tortor sollicitudin mi sit amet lobortis sapien,16,408,24
409,faucibus orci luctus et ultrices posuere cubilia curae donec pharetra magna vestibulum,6,409,14
410,augue vel accumsan tellus nisi eu orci mauris lacinia sapien quis,15,410,18
411,tortor duis mattis egestas metus aenean fermentum donec ut mauris eget massa tempor convallis nulla neque libero convallis,16,411,9
412,curae mauris viverra diam vitae quam suspendisse potenti nullam porttitor lacus at turpis donec posuere metus vitae,12,412,22
413,sit amet turpis elementum ligula vehicula consequat morbi a ipsum integer a nibh in quis justo maecenas,17,413,9
414,mollis molestie lorem quisque ut erat curabitur gravida nisi at nibh in,1,414,8
415,congue etiam justo etiam pretium iaculis justo in hac habitasse platea dictumst etiam faucibus,4,415,15
416,aliquam augue quam sollicitudin vitae consectetuer eget rutrum at lorem integer tincidunt ante vel ipsum praesent blandit lacinia,5,416,4
417,aenean auctor gravida sem praesent id massa id nisl venenatis lacinia aenean sit amet justo,4,417,12
418,dui nec nisi volutpat eleifend donec ut dolor morbi vel lectus in quam fringilla rhoncus mauris enim leo rhoncus,1,418,8
419,condimentum id luctus nec molestie sed justo pellentesque viverra pede,4,419,22
420,maecenas leo odio condimentum id luctus nec molestie sed justo pellentesque viverra pede ac diam cras pellentesque volutpat dui,15,420,4
421,vestibulum ante ipsum primis in faucibus orci luctus et ultrices posuere,7,421,16
422,hac habitasse platea dictumst aliquam augue quam sollicitudin vitae consectetuer eget rutrum at lorem integer tincidunt ante vel ipsum praesent,7,422,3
423,curae duis faucibus accumsan odio curabitur convallis duis consequat dui nec nisi volutpat eleifend donec ut dolor,12,423,1
424,eget massa tempor convallis nulla neque libero convallis eget eleifend luctus ultricies eu nibh,4,424,21
425,in felis eu sapien cursus vestibulum proin eu mi nulla,14,425,11
426,eget rutrum at lorem integer tincidunt ante vel ipsum praesent blandit lacinia erat,18,426,9
427,sollicitudin mi sit amet lobortis sapien sapien non mi integer ac neque duis bibendum morbi non quam nec dui luctus,1,427,23
428,quam suspendisse potenti nullam porttitor lacus at turpis donec posuere metus vitae,5,428,5
429,lorem quisque ut erat curabitur gravida nisi at nibh in hac habitasse platea dictumst aliquam augue,19,429,13
430,nunc nisl duis bibendum felis sed interdum venenatis turpis enim blandit mi in porttitor pede justo eu massa donec,20,430,23
431,ligula nec sem duis aliquam convallis nunc proin at turpis a pede posuere nonummy integer non velit donec diam neque,6,431,11
432,rhoncus aliquam lacus morbi quis tortor id nulla ultrices aliquet maecenas leo odio condimentum id luctus nec molestie sed,4,432,13
433,iaculis justo in hac habitasse platea dictumst etiam faucibus cursus urna,20,433,5
434,pellentesque eget nunc donec quis orci eget orci vehicula condimentum curabitur in libero ut massa volutpat convallis morbi odio odio,5,434,6
435,diam in magna bibendum imperdiet nullam orci pede venenatis non sodales sed tincidunt eu felis fusce posuere felis sed,9,435,21
436,nulla sed vel enim sit amet nunc viverra dapibus nulla suscipit ligula in lacus curabitur at,17,436,2
437,odio in hac habitasse platea dictumst maecenas ut massa quis augue luctus tincidunt,14,437,8
438,parturient montes nascetur ridiculus mus vivamus vestibulum sagittis sapien cum sociis natoque penatibus et magnis dis,10,438,16
439,tellus nisi eu orci mauris lacinia sapien quis libero nullam sit,5,439,18
440,fusce consequat nulla nisl nunc nisl duis bibendum felis sed interdum venenatis turpis enim,15,440,8
441,dapibus duis at velit eu est congue elementum in hac habitasse platea dictumst morbi vestibulum velit id,19,441,9
442,pharetra magna ac consequat metus sapien ut nunc vestibulum ante ipsum primis in faucibus orci luctus et,15,442,3
443,quam turpis adipiscing lorem vitae mattis nibh ligula nec sem,10,443,2
444,quis turpis eget elit sodales scelerisque mauris sit amet eros suspendisse accumsan tortor quis turpis sed ante vivamus tortor duis,5,444,16
445,sem duis aliquam convallis nunc proin at turpis a pede posuere nonummy integer non velit donec diam neque,12,445,8
446,massa id nisl venenatis lacinia aenean sit amet justo morbi ut odio cras mi pede,9,446,19
447,sapien ut nunc vestibulum ante ipsum primis in faucibus orci luctus et ultrices posuere cubilia curae mauris viverra,2,447,1
448,augue quam sollicitudin vitae consectetuer eget rutrum at lorem integer tincidunt ante vel ipsum praesent blandit lacinia erat,18,448,3
449,pellentesque viverra pede ac diam cras pellentesque volutpat dui maecenas tristique est et tempus semper est quam,17,449,13
450,in libero ut massa volutpat convallis morbi odio odio elementum eu,11,450,6
451,purus aliquet at feugiat non pretium quis lectus suspendisse potenti in,11,451,16
452,viverra pede ac diam cras pellentesque volutpat dui maecenas tristique est et tempus semper est quam,1,452,14
453,nulla eget eros elementum pellentesque quisque porta volutpat erat quisque erat eros viverra eget congue eget semper rutrum nulla nunc,7,453,11
454,vestibulum ac est lacinia nisi venenatis tristique fusce congue diam id ornare imperdiet sapien urna,14,454,11
455,leo odio condimentum id luctus nec molestie sed justo pellentesque viverra pede ac,3,455,1
456,morbi ut odio cras mi pede malesuada in imperdiet et commodo,13,456,14
457,ultrices posuere cubilia curae donec pharetra magna vestibulum aliquet ultrices erat tortor sollicitudin mi sit amet lobortis sapien,13,457,10
458,pede posuere nonummy integer non velit donec diam neque vestibulum eget vulputate ut ultrices vel,8,458,13
459,ac leo pellentesque ultrices mattis odio donec vitae nisi nam ultrices libero,8,459,13
460,cursus vestibulum proin eu mi nulla ac enim in tempor,10,460,21
461,eget tempus vel pede morbi porttitor lorem id ligula suspendisse ornare consequat lectus in,3,461,14
462,amet eleifend pede libero quis orci nullam molestie nibh in lectus pellentesque,14,462,24
463,dolor sit amet consectetuer adipiscing elit proin interdum mauris non ligula pellentesque ultrices phasellus id,5,463,17
464,est et tempus semper est quam pharetra magna ac consequat metus sapien ut nunc vestibulum ante ipsum primis,13,464,15
465,erat nulla tempus vivamus in felis eu sapien cursus vestibulum proin eu mi nulla ac,14,465,11
466,vehicula condimentum curabitur in libero ut massa volutpat convallis morbi odio,14,466,11
467,donec pharetra magna vestibulum aliquet ultrices erat tortor sollicitudin mi,4,467,1
468,turpis eget elit sodales scelerisque mauris sit amet eros suspendisse accumsan tortor quis turpis sed ante vivamus tortor duis mattis,10,468,14
469,consequat dui nec nisi volutpat eleifend donec ut dolor morbi vel lectus in quam fringilla rhoncus mauris enim leo rhoncus,8,469,5
470,ut suscipit a feugiat et eros vestibulum ac est lacinia nisi venenatis tristique fusce congue,2,470,16
471,primis in faucibus orci luctus et ultrices posuere cubilia curae nulla dapibus dolor vel,18,471,2
472,nam dui proin leo odio porttitor id consequat in consequat,5,472,22
473,eget congue eget semper rutrum nulla nunc purus phasellus in felis donec semper sapien a libero,9,473,20
474,in leo maecenas pulvinar lobortis est phasellus sit amet erat nulla tempus vivamus in,10,474,6
475,pede morbi porttitor lorem id ligula suspendisse ornare consequat lectus,13,475,17
476,nibh quisque id justo sit amet sapien dignissim vestibulum vestibulum,14,476,15
477,proin leo odio porttitor id consequat in consequat ut nulla sed,7,477,6
478,pharetra magna ac consequat metus sapien ut nunc vestibulum ante ipsum primis in faucibus orci luctus et ultrices,12,478,25
479,aliquam erat volutpat in congue etiam justo etiam pretium iaculis justo in hac habitasse platea dictumst,3,479,19
480,non velit nec nisi vulputate nonummy maecenas tincidunt lacus at velit vivamus vel,16,480,10
