481,pellentesque volutpat dui maecenas tristique est et tempus semper est quam pharetra magna ac,20,481,16
482,porta volutpat quam pede lobortis ligula sit amet eleifend pede libero quis orci nullam molestie nibh in,11,482,22
483,elit ac nulla sed vel enim sit amet nunc viverra dapibus nulla,10,483,2
484,libero quis orci nullam molestie nibh in lectus pellentesque at nulla suspendisse potenti cras in purus eu,13,484,5
485,sapien cum sociis natoque penatibus et magnis dis parturient montes nascetur,4,485,2
486,in imperdiet et commodo vulputate justo in blandit ultrices enim lorem ipsum dolor sit amet consectetuer adipiscing,9,486,13
487,id consequat in consequat ut nulla sed accumsan felis ut at dolor quis,12,487,20
488,pretium nisl ut volutpat sapien arcu sed augue aliquam erat volutpat in congue,1,488,20
489,mauris eget massa tempor convallis nulla neque libero convallis eget eleifend luctus ultricies eu nibh quisque id justo sit,14,489,4
490,ipsum integer a nibh in quis justo maecenas rhoncus aliquam,10,490,12
491,nulla suspendisse potenti cras in purus eu magna vulputate luctus,9,491,8
492,a ipsum integer a nibh in quis justo maecenas rhoncus aliquam lacus morbi quis tortor id nulla ultrices aliquet,5,492,4
493,morbi sem mauris laoreet ut rhoncus aliquet pulvinar sed nisl nunc rhoncus,4,493,16
494,congue etiam justo etiam pretium iaculis justo in hac habitasse,13,494,20
495,placerat ante nulla justo aliquam quis turpis eget elit sodales scelerisque mauris sit amet eros suspendisse accumsan tortor,18,495,7
496,ut odio cras mi pede malesuada in imperdiet et commodo vulputate justo in blandit ultrices,9,496,14
497,ac leo pellentesque ultrices mattis odio donec vitae nisi nam ultrices libero non mattis pulvinar nulla pede ullamcorper,14,497,13
498,sollicitudin mi sit amet lobortis sapien sapien non mi integer ac neque duis,20,498,21
499,quam nec dui luctus rutrum nulla tellus in sagittis dui vel nisl duis ac nibh fusce lacus purus aliquet,18,499,20
500,nam dui proin leo odio porttitor id consequat in consequat ut,8,500,20
501,neque aenean auctor gravida sem praesent id massa id nisl venenatis lacinia aenean sit amet justo morbi ut odio,16,501,20
502,at lorem integer tincidunt ante vel ipsum praesent blandit lacinia erat vestibulum sed magna at nunc commodo placerat praesent blandit,17,502,1
503,massa volutpat convallis morbi odio odio elementum eu interdum eu tincidunt in leo maecenas pulvinar lobortis est phasellus sit,20,503,13
504,erat vestibulum sed magna at nunc commodo placerat praesent blandit nam nulla integer pede justo,3,504,14
505,ut at dolor quis odio consequat varius integer ac leo pellentesque ultrices mattis odio donec vitae nisi nam ultrices,1,505,17
506,sit amet consectetuer adipiscing elit proin interdum mauris non ligula pellentesque ultrices phasellus id sapien in sapien iaculis,10,506,4
507,ac enim in tempor turpis nec euismod scelerisque quam turpis adipiscing lorem vitae mattis nibh ligula nec sem,19,507,16
508,placerat ante nulla justo aliquam quis turpis eget elit sodales scelerisque mauris sit amet eros suspendisse accumsan tortor quis,1,508,2
509,ultrices posuere cubilia curae nulla dapibus dolor vel est donec odio justo sollicitudin ut suscipit a feugiat,5,509,2
510,blandit mi in porttitor pede justo eu massa donec dapibus duis at velit,17,510,1
511,integer pede justo lacinia eget tincidunt eget tempus vel pede morbi porttitor lorem id ligula,2,511,23
512,mauris viverra diam vitae quam suspendisse potenti nullam porttitor lacus at turpis donec posuere metus vitae,1,512,21
513,ipsum dolor sit amet consectetuer adipiscing elit proin risus praesent lectus vestibulum quam sapien varius,17,513,14
514,sit amet lobortis sapien sapien non mi integer ac neque duis bibendum morbi non quam nec dui luctus,9,514,21
515,lobortis sapien sapien non mi integer ac neque duis bibendum morbi non quam nec dui luctus rutrum nulla tellus in,2,515,22
516,bibendum morbi non quam nec dui luctus rutrum nulla tellus in sagittis dui vel nisl duis ac,20,516,3
517,et magnis dis parturient montes nascetur ridiculus mus etiam vel,12,517,9
518,quis odio consequat varius integer ac leo pellentesque ultrices mattis odio donec vitae nisi nam ultrices libero non,9,518,20
519,lorem quisque ut erat curabitur gravida nisi at nibh in hac habitasse platea dictumst aliquam augue quam,20,519,3
520,faucibus accumsan odio curabitur convallis duis consequat dui nec nisi volutpat eleifend donec ut dolor morbi vel,5,520,14
521,sapien quis libero nullam sit amet turpis elementum ligula vehicula consequat morbi a ipsum integer a nibh in quis justo,12,521,4
522,ac tellus semper interdum mauris ullamcorper purus sit amet nulla quisque arcu libero,2,522,8
523,scelerisque mauris sit amet eros suspendisse accumsan tortor quis turpis sed ante vivamus tortor duis mattis egestas,17,523,20
524,dolor sit amet consectetuer adipiscing elit proin risus praesent lectus vestibulum quam sapien,20,524,20
525,eros vestibulum ac est lacinia nisi venenatis tristique fusce congue diam id,1,525,9
526,erat tortor sollicitudin mi sit amet lobortis sapien sapien non mi integer ac neque duis bibendum morbi non quam nec,16,526,19
527,tincidunt ante vel ipsum praesent blandit lacinia erat vestibulum sed magna at nunc commodo,11,527,13
528,nullam porttitor lacus at turpis donec posuere metus vitae ipsum aliquam non mauris morbi non,8,528,10
529,lacus morbi quis tortor id nulla ultrices aliquet maecenas leo odio condimentum id luctus nec molestie sed justo pellentesque,18,529,2
530,turpis donec posuere metus vitae ipsum aliquam non mauris morbi non lectus aliquam sit amet diam in,1,530,16
531,metus arcu adipiscing molestie hendrerit at vulputate vitae nisl aenean lectus pellentesque eget nunc donec quis orci eget orci vehicula,20,531,24
532,congue vivamus metus arcu adipiscing molestie hendrerit at vulputate vitae nisl aenean lectus pellentesque eget nunc,19,532,12
533,vestibulum ante ipsum primis in faucibus orci luctus et ultrices posuere cubilia,11,533,14
534,luctus nec molestie sed justo pellentesque viverra pede ac diam cras pellentesque,4,534,14
535,amet eleifend pede libero quis orci nullam molestie nibh in,14,535,9
536,ante ipsum primis in faucibus orci luctus et ultrices posuere cubilia curae,2,536,15
537,consequat dui nec nisi volutpat eleifend donec ut dolor morbi vel lectus in,5,537,4
538,in hac habitasse platea dictumst etiam faucibus cursus urna ut tellus nulla ut erat id mauris,20,538,20
539,eget eleifend luctus ultricies eu nibh quisque id justo sit amet sapien dignissim vestibulum vestibulum ante ipsum primis in faucibus,11,539,9
540,interdum mauris ullamcorper purus sit amet nulla quisque arcu libero,6,540,16
541,consequat varius integer ac leo pellentesque ultrices mattis odio donec,10,541,25
542,tincidunt eu felis fusce posuere felis sed lacus morbi sem mauris laoreet ut rhoncus aliquet,15,542,2
543,tempus vivamus in felis eu sapien cursus vestibulum proin eu mi,9,543,10
544,nisl nunc rhoncus dui vel sem sed sagittis nam congue risus semper,5,544,13
545,dictumst maecenas ut massa quis augue luctus tincidunt nulla mollis molestie lorem quisque,18,545,1
546,magnis dis parturient montes nascetur ridiculus mus vivamus vestibulum sagittis sapien cum sociis natoque penatibus et magnis dis parturient montes,3,546,3
547,enim leo rhoncus sed vestibulum sit amet cursus id turpis integer aliquet massa id lobortis,10,547,17
548,cubilia curae duis faucibus accumsan odio curabitur convallis duis consequat dui nec nisi volutpat,3,548,20
549,quam pede lobortis ligula sit amet eleifend pede libero quis orci nullam molestie nibh in lectus pellentesque at nulla suspendisse,12,549,8
550,parturient montes nascetur ridiculus mus vivamus vestibulum sagittis sapien cum sociis,7,550,11
551,posuere cubilia curae nulla dapibus dolor vel est donec odio justo sollicitudin ut suscipit a feugiat et,1,551,12
552,neque aenean auctor gravida sem praesent id massa id nisl venenatis lacinia aenean sit amet justo morbi ut,4,552,8
553,blandit non interdum in ante vestibulum ante ipsum primis in faucibus orci luctus,11,553,19
554,vestibulum velit id pretium iaculis diam erat fermentum justo nec condimentum neque,4,554,18
555,cum sociis natoque penatibus et magnis dis parturient montes nascetur ridiculus mus,8,555,23
556,dui luctus rutrum nulla tellus in sagittis dui vel nisl duis ac nibh,14,556,8
557,id pretium iaculis diam erat fermentum justo nec condimentum neque sapien placerat ante nulla justo aliquam quis turpis eget elit,4,557,7
558,amet cursus id turpis integer aliquet massa id lobortis convallis tortor risus dapibus augue vel accumsan tellus nisi eu orci,4,558,20
559,morbi vestibulum velit id pretium iaculis diam erat fermentum justo nec condimentum neque sapien placerat ante nulla justo aliquam quis,12,559,10
560,convallis eget eleifend luctus ultricies eu nibh quisque id justo sit amet sapien dignissim vestibulum,16,560,21
561,aenean lectus pellentesque eget nunc donec quis orci eget orci vehicula condimentum curabitur in libero ut,11,561,19
562,at nibh in hac habitasse platea dictumst aliquam augue quam sollicitudin vitae consectetuer eget rutrum at lorem integer tincidunt ante,17,562,11
563,eget eleifend luctus ultricies eu nibh quisque id justo sit amet sapien,20,563,1
564,hac habitasse platea dictumst aliquam augue quam sollicitudin vitae consectetuer eget rutrum at lorem integer tincidunt ante vel ipsum,19,564,3
565,mattis egestas metus aenean fermentum donec ut mauris eget massa tempor convallis nulla neque libero,6,565,23
566,congue risus semper porta volutpat quam pede lobortis ligula sit amet eleifend pede,4,566,14
567,fusce congue diam id ornare imperdiet sapien urna pretium nisl ut volutpat sapien arcu sed augue aliquam erat volutpat,13,567,1
568,habitasse platea dictumst maecenas ut massa quis augue luctus tincidunt nulla mollis molestie lorem quisque ut erat curabitur gravida,5,568,4
569,pulvinar sed nisl nunc rhoncus dui vel sem sed sagittis nam congue risus semper porta volutpat,1,569,24
570,ipsum primis in faucibus orci luctus et ultrices posuere cubilia curae donec pharetra magna,10,570,17
571,ut mauris eget massa tempor convallis nulla neque libero convallis eget eleifend luctus ultricies eu nibh quisque,19,571,12
572,non quam nec dui luctus rutrum nulla tellus in sagittis dui vel nisl duis,11,572,20
573,morbi quis tortor id nulla ultrices aliquet maecenas leo odio condimentum id luctus nec molestie sed justo pellentesque viverra pede,14,573,16
574,justo morbi ut odio cras mi pede malesuada in imperdiet et commodo vulputate justo in blandit,14,574,1
575,congue eget semper rutrum nulla nunc purus phasellus in felis donec semper sapien a,9,575,2
576,metus sapien ut nunc vestibulum ante ipsum primis in faucibus orci luctus et,19,576,4
577,mattis nibh ligula nec sem duis aliquam convallis nunc proin at turpis a pede posuere nonummy integer,10,577,25
578,justo morbi ut odio cras mi pede malesuada in imperdiet et commodo vulputate justo in,6,578,24
579,suspendisse accumsan tortor quis turpis sed ante vivamus tortor duis mattis egestas metus aenean,1,579,11
580,ipsum ac tellus semper interdum mauris ullamcorper purus sit amet nulla quisque arcu libero rutrum ac lobortis vel,17,580,20
581,justo in blandit ultrices enim lorem ipsum dolor sit amet consectetuer adipiscing elit proin interdum mauris non ligula,18,581,19
582,sollicitudin ut suscipit a feugiat et eros vestibulum ac est lacinia nisi,18,582,22
583,faucibus orci luctus et ultrices posuere cubilia curae donec pharetra magna vestibulum aliquet ultrices erat,16,583,2
584,suspendisse accumsan tortor quis turpis sed ante vivamus tortor duis,2,584,16
585,dis parturient montes nascetur ridiculus mus etiam vel augue vestibulum rutrum rutrum neque aenean auctor,8,585,16
586,posuere cubilia curae mauris viverra diam vitae quam suspendisse potenti nullam,6,586,3
587,ligula sit amet eleifend pede libero quis orci nullam molestie nibh in lectus pellentesque at nulla suspendisse potenti cras in,10,587,25
588,rhoncus sed vestibulum sit amet cursus id turpis integer aliquet massa,10,588,15
589,rhoncus aliquet pulvinar sed nisl nunc rhoncus dui vel sem sed sagittis nam congue risus semper,12,589,25
590,sit amet justo morbi ut odio cras mi pede malesuada in,4,590,1
591,leo pellentesque ultrices mattis odio donec vitae nisi nam ultrices libero non,20,591,4
592,donec dapibus duis at velit eu est congue elementum in hac habitasse platea dictumst morbi vestibulum velit id pretium,11,592,22
593,interdum mauris non ligula pellentesque ultrices phasellus id sapien in sapien iaculis congue vivamus metus arcu adipiscing,10,593,9
594,maecenas ut massa quis augue luctus tincidunt nulla mollis molestie lorem quisque ut erat curabitur,6,594,1
595,tincidunt eu felis fusce posuere felis sed lacus morbi sem mauris laoreet ut rhoncus aliquet pulvinar,7,595,19
596,justo sit amet sapien dignissim vestibulum vestibulum ante ipsum primis in faucibus orci luctus et,19,596,6
597,eros suspendisse accumsan tortor quis turpis sed ante vivamus tortor duis mattis egestas metus aenean fermentum donec,18,597,4
598,pulvinar nulla pede ullamcorper augue a suscipit nulla elit ac nulla sed vel enim,20,598,19
599,quam pharetra magna ac consequat metus sapien ut nunc vestibulum,7,599,15
600,bibendum morbi non quam nec dui luctus rutrum nulla tellus in sagittis dui vel nisl duis ac nibh fusce lacus,4,600,2
601,in leo maecenas pulvinar lobortis est phasellus sit amet erat nulla tempus vivamus in felis eu sapien cursus vestibulum,14,601,21
602,lacinia eget tincidunt eget tempus vel pede morbi porttitor lorem id ligula suspendisse ornare consequat lectus in,7,602,24
603,a libero nam dui proin leo odio porttitor id consequat in consequat,4,603,9
604,dolor morbi vel lectus in quam fringilla rhoncus mauris enim leo rhoncus sed vestibulum sit amet cursus id turpis,15,604,20
605,congue risus semper porta volutpat quam pede lobortis ligula sit amet eleifend pede libero quis orci,20,605,17
606,mauris morbi non lectus aliquam sit amet diam in magna bibendum imperdiet nullam orci pede venenatis non sodales,9,606,21
607,vel enim sit amet nunc viverra dapibus nulla suscipit ligula in lacus,15,607,7
608,accumsan tellus nisi eu orci mauris lacinia sapien quis libero nullam sit amet turpis elementum ligula vehicula consequat morbi,19,608,6
609,consequat varius integer ac leo pellentesque ultrices mattis odio donec vitae nisi nam ultrices libero non mattis,8,609,3
610,lobortis est phasellus sit amet erat nulla tempus vivamus in felis,10,610,13
611,urna ut tellus nulla ut erat id mauris vulputate elementum nullam varius,19,611,14
612,mauris ullamcorper purus sit amet nulla quisque arcu libero rutrum ac lobortis vel dapibus at diam,7,612,24
613,ultrices posuere cubilia curae mauris viverra diam vitae quam suspendisse potenti nullam porttitor lacus at,7,613,1
614,quisque erat eros viverra eget congue eget semper rutrum nulla nunc purus phasellus,17,614,8
615,neque sapien placerat ante nulla justo aliquam quis turpis eget,18,615,15
616,bibendum imperdiet nullam orci pede venenatis non sodales sed tincidunt eu felis fusce posuere felis sed lacus morbi sem,18,616,6
617,cursus urna ut tellus nulla ut erat id mauris vulputate elementum nullam varius nulla facilisi cras non velit nec,7,617,14
618,sollicitudin ut suscipit a feugiat et eros vestibulum ac est lacinia nisi venenatis tristique fusce congue diam id ornare,4,618,18
619,erat nulla tempus vivamus in felis eu sapien cursus vestibulum proin eu mi nulla ac,14,619,12
620,sit amet consectetuer adipiscing elit proin interdum mauris non ligula pellentesque ultrices phasellus id sapien in sapien iaculis congue vivamus,12,620,1
621,et ultrices posuere cubilia curae duis faucibus accumsan odio curabitur convallis duis consequat dui nec nisi volutpat,9,621,2
622,nisi venenatis tristique fusce congue diam id ornare imperdiet sapien urna pretium nisl ut volutpat sapien arcu sed augue aliquam,19,622,20
623,mus etiam vel augue vestibulum rutrum rutrum neque aenean auctor gravida sem,18,623,10
624,aliquam lacus morbi quis tortor id nulla ultrices aliquet maecenas leo,14,624,15
625,sapien sapien non mi integer ac neque duis bibendum morbi non quam nec dui luctus rutrum nulla tellus,8,625,17
626,dictumst aliquam augue quam sollicitudin vitae consectetuer eget rutrum at lorem integer tincidunt ante vel ipsum praesent blandit lacinia erat,3,626,9
627,vestibulum ante ipsum primis in faucibus orci luctus et ultrices posuere cubilia curae mauris viverra diam vitae quam suspendisse potenti,19,627,14
628,nisi volutpat eleifend donec ut dolor morbi vel lectus in quam fringilla rhoncus mauris enim,3,628,4
629,cubilia curae duis faucibus accumsan odio curabitur convallis duis consequat dui nec nisi,20,629,13
630,odio donec vitae nisi nam ultrices libero non mattis pulvinar nulla pede ullamcorper augue a suscipit,13,630,16
631,morbi non lectus aliquam sit amet diam in magna bibendum imperdiet nullam,4,631,22
632,at ipsum ac tellus semper interdum mauris ullamcorper purus sit amet nulla quisque arcu libero rutrum ac lobortis,14,632,19
633,adipiscing elit proin risus praesent lectus vestibulum quam sapien varius ut blandit non,6,633,17
634,lectus pellentesque at nulla suspendisse potenti cras in purus eu magna vulputate luctus,16,634,2
635,diam cras pellentesque volutpat dui maecenas tristique est et tempus semper est,16,635,11
636,diam in magna bibendum imperdiet nullam orci pede venenatis non sodales sed tincidunt eu,15,636,1
637,blandit mi in porttitor pede justo eu massa donec dapibus duis at velit eu,4,637,12
