1,scelerisque mauris sit amet eros suspendisse accumsan tortor quis turpis sed ante vivamus tortor,20,1,19
2,id nisl venenatis lacinia aenean sit amet justo morbi ut odio cras,17,2,18
3,felis ut at dolor quis odio consequat varius integer ac leo pellentesque ultrices mattis odio donec vitae nisi nam,6,3,2
4,sociis natoque penatibus et magnis dis parturient montes nascetur ridiculus mus etiam vel augue vestibulum rutrum rutrum neque,10,4,24
5,nec condimentum neque sapien placerat ante nulla justo aliquam quis turpis,14,5,2
6,elementum eu interdum eu tincidunt in leo maecenas pulvinar lobortis est phasellus sit amet erat,9,6,3
7,congue risus semper porta volutpat quam pede lobortis ligula sit amet eleifend pede,14,7,14
8,vel nulla eget eros elementum pellentesque quisque porta volutpat erat quisque erat eros viverra eget,12,8,4
9,vestibulum proin eu mi nulla ac enim in tempor turpis nec euismod,17,9,8
10,consectetuer adipiscing elit proin interdum mauris non ligula pellentesque ultrices phasellus,13,10,23
11,ac est lacinia nisi venenatis tristique fusce congue diam id,4,11,17
12,at vulputate vitae nisl aenean lectus pellentesque eget nunc donec quis,11,12,11
13,posuere metus vitae ipsum aliquam non mauris morbi non lectus aliquam sit amet,10,13,16
14,fusce congue diam id ornare imperdiet sapien urna pretium nisl ut,8,14,19
15,massa id nisl venenatis lacinia aenean sit amet justo morbi ut odio,4,15,16
16,in faucibus orci luctus et ultrices posuere cubilia curae nulla dapibus dolor vel,9,16,17
17,sit amet consectetuer adipiscing elit proin risus praesent lectus vestibulum quam sapien,3,17,8
18,mattis odio donec vitae nisi nam ultrices libero non mattis pulvinar nulla pede,16,18,16
19,massa volutpat convallis morbi odio odio elementum eu interdum eu tincidunt in leo maecenas,17,19,14
20,velit nec nisi vulputate nonummy maecenas tincidunt lacus at velit vivamus vel nulla eget eros elementum,18,20,13
21,luctus et ultrices posuere cubilia curae duis faucibus accumsan odio curabitur convallis duis,9,21,19
22,at turpis donec posuere metus vitae ipsum aliquam non mauris,11,22,2
23,consequat morbi a ipsum integer a nibh in quis justo maecenas rhoncus aliquam lacus,1,23,25
24,fringilla rhoncus mauris enim leo rhoncus sed vestibulum sit amet cursus id turpis integer aliquet massa,15,24,9
25,at turpis donec posuere metus vitae ipsum aliquam non mauris morbi,1,25,9
26,aenean sit amet justo morbi ut odio cras mi pede malesuada in imperdiet et commodo vulputate,3,26,18
27,quam nec dui luctus rutrum nulla tellus in sagittis dui,12,27,15
28,magna vulputate luctus cum sociis natoque penatibus et magnis dis parturient montes nascetur ridiculus mus vivamus vestibulum sagittis,15,28,15
29,dui luctus rutrum nulla tellus in sagittis dui vel nisl duis ac nibh fusce lacus purus aliquet,7,29,15
30,arcu sed augue aliquam erat volutpat in congue etiam justo etiam pretium iaculis justo in,12,30,13
31,sapien placerat ante nulla justo aliquam quis turpis eget elit sodales scelerisque mauris sit amet,10,31,13
32,curabitur at ipsum ac tellus semper interdum mauris ullamcorper purus sit amet nulla quisque arcu libero rutrum ac lobortis,14,32,23
33,pellentesque quisque porta volutpat erat quisque erat eros viverra eget congue eget,13,33,15
34,nec sem duis aliquam convallis nunc proin at turpis a pede,17,34,4
35,quis libero nullam sit amet turpis elementum ligula vehicula consequat,2,35,16
36,eu est congue elementum in hac habitasse platea dictumst morbi vestibulum,15,36,18
37,odio elementum eu interdum eu tincidunt in leo maecenas pulvinar lobortis est phasellus,20,37,18
38,morbi vestibulum velit id pretium iaculis diam erat fermentum justo,10,38,1
39,nunc nisl duis bibendum felis sed interdum venenatis turpis enim blandit mi in porttitor,18,39,21
40,semper interdum mauris ullamcorper purus sit amet nulla quisque arcu libero rutrum ac lobortis vel dapibus at diam nam tristique,17,40,18
41,velit eu est congue elementum in hac habitasse platea dictumst morbi vestibulum velit id pretium iaculis,5,41,19
42,orci luctus et ultrices posuere cubilia curae nulla dapibus dolor vel est donec odio justo sollicitudin ut suscipit,18,42,12
43,nisl nunc nisl duis bibendum felis sed interdum venenatis turpis enim blandit mi in porttitor pede justo eu massa,12,43,24
44,sit amet eros suspendisse accumsan tortor quis turpis sed ante vivamus tortor duis mattis egestas,10,44,23
45,platea dictumst etiam faucibus cursus urna ut tellus nulla ut erat id mauris vulputate elementum nullam,16,45,4
46,ut nunc vestibulum ante ipsum primis in faucibus orci luctus et ultrices posuere cubilia curae mauris,6,46,2
47,ipsum integer a nibh in quis justo maecenas rhoncus aliquam,7,47,22
48,in tempor turpis nec euismod scelerisque quam turpis adipiscing lorem vitae mattis,14,48,17
49,nam dui proin leo odio porttitor id consequat in consequat ut nulla sed accumsan felis ut at dolor,7,49,14
50,amet erat nulla tempus vivamus in felis eu sapien cursus vestibulum proin eu mi,4,50,5
51,duis ac nibh fusce lacus purus aliquet at feugiat non pretium quis lectus suspendisse potenti in,10,51,22
52,nisl nunc nisl duis bibendum felis sed interdum venenatis turpis enim blandit mi in porttitor pede justo eu,4,52,4
53,justo in hac habitasse platea dictumst etiam faucibus cursus urna ut tellus nulla ut erat id mauris vulputate elementum nullam,1,53,6
54,ultrices vel augue vestibulum ante ipsum primis in faucibus orci luctus et ultrices,18,54,25
55,amet cursus id turpis integer aliquet massa id lobortis convallis tortor risus dapibus augue vel accumsan tellus nisi eu,17,55,15
56,suspendisse potenti in eleifend quam a odio in hac habitasse platea dictumst maecenas,11,56,13
57,orci luctus et ultrices posuere cubilia curae donec pharetra magna vestibulum aliquet ultrices erat tortor sollicitudin mi sit amet,4,57,16
58,congue etiam justo etiam pretium iaculis justo in hac habitasse platea dictumst etiam faucibus cursus urna ut tellus nulla,8,58,4
59,commodo placerat praesent blandit nam nulla integer pede justo lacinia eget tincidunt eget tempus vel,5,59,23
60,in quam fringilla rhoncus mauris enim leo rhoncus sed vestibulum sit amet cursus id turpis integer aliquet massa id,13,60,22
61,lacus morbi quis tortor id nulla ultrices aliquet maecenas leo odio condimentum id,19,61,21
62,et ultrices posuere cubilia curae donec pharetra magna vestibulum aliquet ultrices erat tortor sollicitudin mi sit,20,62,19
63,luctus et ultrices posuere cubilia curae duis faucibus accumsan odio curabitur convallis,18,63,8
64,purus eu magna vulputate luctus cum sociis natoque penatibus et magnis dis parturient montes nascetur ridiculus mus vivamus vestibulum sagittis,10,64,17
65,rutrum nulla nunc purus phasellus in felis donec semper sapien a libero nam dui proin leo odio porttitor id,15,65,11
66,consectetuer eget rutrum at lorem integer tincidunt ante vel ipsum praesent blandit lacinia erat vestibulum sed magna at,6,66,5
67,nullam sit amet turpis elementum ligula vehicula consequat morbi a ipsum integer a,12,67,17
68,cras non velit nec nisi vulputate nonummy maecenas tincidunt lacus at velit,8,68,12
69,velit id pretium iaculis diam erat fermentum justo nec condimentum neque sapien placerat ante nulla justo aliquam quis,11,69,12
70,est lacinia nisi venenatis tristique fusce congue diam id ornare imperdiet sapien urna pretium nisl ut volutpat sapien arcu,19,70,2
71,libero non mattis pulvinar nulla pede ullamcorper augue a suscipit nulla elit ac nulla sed vel,5,71,24
72,vel nisl duis ac nibh fusce lacus purus aliquet at feugiat non pretium quis lectus suspendisse potenti in,18,72,17
73,maecenas leo odio condimentum id luctus nec molestie sed justo pellentesque viverra pede ac diam cras pellentesque volutpat dui,12,73,18
74,semper sapien a libero nam dui proin leo odio porttitor id consequat in consequat ut nulla sed,12,74,11
75,a nibh in quis justo maecenas rhoncus aliquam lacus morbi quis tortor id nulla,15,75,25
76,amet cursus id turpis integer aliquet massa id lobortis convallis tortor risus,2,76,22
77,ultrices phasellus id sapien in sapien iaculis congue vivamus metus arcu adipiscing,10,77,23
78,erat id mauris vulputate elementum nullam varius nulla facilisi cras non,4,78,8
79,tortor quis turpis sed ante vivamus tortor duis mattis egestas metus aenean,20,79,14
80,non interdum in ante vestibulum ante ipsum primis in faucibus orci luctus et ultrices posuere cubilia,11,80,4
81,orci mauris lacinia sapien quis libero nullam sit amet turpis elementum ligula vehicula consequat morbi a,16,81,16
82,varius nulla facilisi cras non velit nec nisi vulputate nonummy maecenas,1,82,9
83,condimentum curabitur in libero ut massa volutpat convallis morbi odio odio,10,83,20
84,ac enim in tempor turpis nec euismod scelerisque quam turpis adipiscing lorem vitae mattis,7,84,10
85,duis faucibus accumsan odio curabitur convallis duis consequat dui nec nisi volutpat eleifend donec ut,14,85,16
86,tellus nulla ut erat id mauris vulputate elementum nullam varius nulla facilisi cras non velit nec nisi,12,86,3
87,etiam pretium iaculis justo in hac habitasse platea dictumst etiam faucibus cursus urna ut tellus nulla ut erat id mauris,15,87,12
88,magna vulputate luctus cum sociis natoque penatibus et magnis dis parturient montes nascetur ridiculus mus vivamus vestibulum,4,88,17
89,risus dapibus augue vel accumsan tellus nisi eu orci mauris lacinia sapien quis,19,89,6
90,nisl aenean lectus pellentesque eget nunc donec quis orci eget,18,90,7
91,tellus semper interdum mauris ullamcorper purus sit amet nulla quisque arcu libero rutrum,11,91,1
92,diam neque vestibulum eget vulputate ut ultrices vel augue vestibulum ante ipsum primis in faucibus orci luctus et ultrices posuere,14,92,12
93,sollicitudin mi sit amet lobortis sapien sapien non mi integer ac neque duis bibendum,18,93,9
94,vitae nisi nam ultrices libero non mattis pulvinar nulla pede ullamcorper augue a suscipit nulla elit ac nulla sed,17,94,13
95,proin leo odio porttitor id consequat in consequat ut nulla sed accumsan felis,12,95,18
96,ultrices vel augue vestibulum ante ipsum primis in faucibus orci luctus et ultrices posuere cubilia curae donec pharetra,5,96,7
97,quis odio consequat varius integer ac leo pellentesque ultrices mattis odio donec vitae,14,97,24
98,rhoncus sed vestibulum sit amet cursus id turpis integer aliquet massa id lobortis convallis tortor,7,98,6
99,ut volutpat sapien arcu sed augue aliquam erat volutpat in congue,5,99,17
100,lacus morbi quis tortor id nulla ultrices aliquet maecenas leo odio condimentum id luctus nec,5,100,20
101,risus dapibus augue vel accumsan tellus nisi eu orci mauris lacinia sapien quis libero nullam sit amet turpis,16,101,13
102,posuere cubilia curae donec pharetra magna vestibulum aliquet ultrices erat tortor sollicitudin mi sit amet,19,102,25
103,iaculis diam erat fermentum justo nec condimentum neque sapien placerat ante nulla justo aliquam,4,103,13
104,dolor morbi vel lectus in quam fringilla rhoncus mauris enim leo rhoncus sed vestibulum sit amet cursus id,19,104,19
105,luctus ultricies eu nibh quisque id justo sit amet sapien dignissim vestibulum vestibulum ante ipsum primis in faucibus orci,16,105,25
106,sit amet sem fusce consequat nulla nisl nunc nisl duis bibendum felis sed interdum venenatis turpis,11,106,3
107,hac habitasse platea dictumst morbi vestibulum velit id pretium iaculis diam erat fermentum justo,6,107,2
108,molestie lorem quisque ut erat curabitur gravida nisi at nibh in hac habitasse platea dictumst aliquam augue,13,108,21
109,congue vivamus metus arcu adipiscing molestie hendrerit at vulputate vitae nisl aenean lectus pellentesque eget nunc,15,109,10
110,quis orci eget orci vehicula condimentum curabitur in libero ut massa volutpat,6,110,15
111,potenti cras in purus eu magna vulputate luctus cum sociis natoque,4,111,21
112,sapien urna pretium nisl ut volutpat sapien arcu sed augue aliquam erat volutpat,13,112,8
113,porttitor pede justo eu massa donec dapibus duis at velit eu est congue elementum in hac,6,113,17
114,metus arcu adipiscing molestie hendrerit at vulputate vitae nisl aenean,8,114,4
115,orci luctus et ultrices posuere cubilia curae mauris viverra diam vitae quam suspendisse potenti nullam,19,115,21
116,quam nec dui luctus rutrum nulla tellus in sagittis dui vel nisl duis ac nibh fusce lacus purus,3,116,22
117,ante vestibulum ante ipsum primis in faucibus orci luctus et,9,117,24
118,varius ut blandit non interdum in ante vestibulum ante ipsum primis in faucibus,6,118,17
119,ut nulla sed accumsan felis ut at dolor quis odio consequat varius integer ac leo,8,119,11
120,eros viverra eget congue eget semper rutrum nulla nunc purus phasellus,14,120,22
121,praesent blandit nam nulla integer pede justo lacinia eget tincidunt eget tempus vel pede morbi porttitor lorem id,20,121,5
122,in eleifend quam a odio in hac habitasse platea dictumst maecenas ut massa quis augue,11,122,13
123,pulvinar sed nisl nunc rhoncus dui vel sem sed sagittis nam congue risus,1,123,24
124,curabitur in libero ut massa volutpat convallis morbi odio odio elementum eu interdum eu tincidunt in leo maecenas pulvinar lobortis,5,124,11
125,neque aenean auctor gravida sem praesent id massa id nisl venenatis lacinia aenean sit amet justo,7,125,19
126,tincidunt nulla mollis molestie lorem quisque ut erat curabitur gravida nisi at nibh in,7,126,10
127,in quam fringilla rhoncus mauris enim leo rhoncus sed vestibulum sit amet cursus id turpis integer aliquet massa id lobortis,16,127,6
128,eget vulputate ut ultrices vel augue vestibulum ante ipsum primis in,19,128,12
129,porttitor lacus at turpis donec posuere metus vitae ipsum aliquam non mauris morbi non lectus aliquam sit amet diam,3,129,4
130,magna bibendum imperdiet nullam orci pede venenatis non sodales sed tincidunt eu felis fusce posuere felis,2,130,14
131,proin eu mi nulla ac enim in tempor turpis nec,7,131,1
132,vel augue vestibulum ante ipsum primis in faucibus orci luctus et ultrices posuere cubilia curae donec pharetra magna vestibulum,16,132,10
133,amet diam in magna bibendum imperdiet nullam orci pede venenatis non sodales sed,17,133,15
134,amet sapien dignissim vestibulum vestibulum ante ipsum primis in faucibus orci luctus et ultrices,1,134,22
135,lorem id ligula suspendisse ornare consequat lectus in est risus auctor sed,6,135,16
136,mauris viverra diam vitae quam suspendisse potenti nullam porttitor lacus at turpis donec posuere metus vitae ipsum aliquam non,6,136,5
137,convallis tortor risus dapibus augue vel accumsan tellus nisi eu orci mauris lacinia sapien quis libero,13,137,6
138,porttitor pede justo eu massa donec dapibus duis at velit eu est congue elementum,16,138,4
139,sodales sed tincidunt eu felis fusce posuere felis sed lacus morbi sem mauris laoreet ut rhoncus,6,139,19
140,nulla tellus in sagittis dui vel nisl duis ac nibh fusce lacus purus aliquet at feugiat non pretium,14,140,7
141,nunc viverra dapibus nulla suscipit ligula in lacus curabitur at ipsum ac tellus semper interdum mauris ullamcorper purus sit,6,141,15
142,risus semper porta volutpat quam pede lobortis ligula sit amet,4,142,19
143,mauris ullamcorper purus sit amet nulla quisque arcu libero rutrum ac lobortis vel dapibus at diam,15,143,23
144,commodo placerat praesent blandit nam nulla integer pede justo lacinia eget tincidunt eget,15,144,23
145,praesent blandit lacinia erat vestibulum sed magna at nunc commodo placerat praesent blandit nam nulla,10,145,11
146,quam sapien varius ut blandit non interdum in ante vestibulum ante ipsum primis,6,146,2
147,ut dolor morbi vel lectus in quam fringilla rhoncus mauris enim leo rhoncus sed vestibulum sit amet cursus id turpis,1,147,9
148,vulputate elementum nullam varius nulla facilisi cras non velit nec nisi vulputate nonummy maecenas tincidunt,1,148,18
149,hac habitasse platea dictumst aliquam augue quam sollicitudin vitae consectetuer eget,13,149,23
150,diam in magna bibendum imperdiet nullam orci pede venenatis non sodales sed,7,150,21
151,volutpat erat quisque erat eros viverra eget congue eget semper rutrum nulla nunc purus phasellus in,8,151,10
152,nisi volutpat eleifend donec ut dolor morbi vel lectus in quam fringilla rhoncus mauris enim leo rhoncus sed vestibulum,15,152,14
153,nulla ut erat id mauris vulputate elementum nullam varius nulla facilisi cras non velit nec nisi vulputate,20,153,3
154,etiam faucibus cursus urna ut tellus nulla ut erat id mauris vulputate,3,154,6
155,ac neque duis bibendum morbi non quam nec dui luctus rutrum nulla,17,155,15
156,felis sed lacus morbi sem mauris laoreet ut rhoncus aliquet pulvinar sed nisl,9,156,25
157,quis augue luctus tincidunt nulla mollis molestie lorem quisque ut erat curabitur gravida nisi at nibh in hac habitasse platea,2,157,13
158,tortor sollicitudin mi sit amet lobortis sapien sapien non mi integer ac neque duis bibendum,19,158,23
159,sed sagittis nam congue risus semper porta volutpat quam pede lobortis ligula sit amet eleifend pede libero quis orci,17,159,25
160,aliquam lacus morbi quis tortor id nulla ultrices aliquet maecenas leo odio condimentum id luctus nec molestie sed,18,160,14
161,sit amet sem fusce consequat nulla nisl nunc nisl duis bibendum felis sed interdum venenatis turpis enim,7,161,23
162,ligula pellentesque ultrices phasellus id sapien in sapien iaculis congue vivamus metus arcu adipiscing molestie hendrerit at vulputate vitae nisl,7,162,10
163,vel augue vestibulum rutrum rutrum neque aenean auctor gravida sem praesent,9,163,5
164,hac habitasse platea dictumst etiam faucibus cursus urna ut tellus nulla ut erat,14,164,17
165,proin eu mi nulla ac enim in tempor turpis nec euismod scelerisque quam turpis adipiscing lorem,9,165,24
166,in hac habitasse platea dictumst morbi vestibulum velit id pretium iaculis diam erat fermentum justo nec condimentum neque,9,166,25
167,venenatis tristique fusce congue diam id ornare imperdiet sapien urna pretium,3,167,15
168,posuere nonummy integer non velit donec diam neque vestibulum eget vulputate ut ultrices vel,11,168,24
169,nulla dapibus dolor vel est donec odio justo sollicitudin ut suscipit a feugiat et eros vestibulum ac est lacinia nisi,14,169,21
170,cras non velit nec nisi vulputate nonummy maecenas tincidunt lacus at velit vivamus vel nulla eget eros elementum pellentesque quisque,17,170,10
171,pellentesque quisque porta volutpat erat quisque erat eros viverra eget congue eget semper rutrum nulla nunc purus phasellus in felis,8,171,12
172,semper porta volutpat quam pede lobortis ligula sit amet eleifend,6,172,16
173,consequat ut nulla sed accumsan felis ut at dolor quis odio,12,173,8
174,eget vulputate ut ultrices vel augue vestibulum ante ipsum primis in faucibus,2,174,4
175,eget elit sodales scelerisque mauris sit amet eros suspendisse accumsan tortor quis turpis sed ante vivamus tortor duis,11,175,13
176,dictumst etiam faucibus cursus urna ut tellus nulla ut erat id mauris vulputate,15,176,21
177,interdum venenatis turpis enim blandit mi in porttitor pede justo eu massa donec dapibus duis at,7,177,3
178,iaculis congue vivamus metus arcu adipiscing molestie hendrerit at vulputate vitae nisl aenean lectus pellentesque,2,178,11
179,enim in tempor turpis nec euismod scelerisque quam turpis adipiscing,9,179,22
180,orci eget orci vehicula condimentum curabitur in libero ut massa volutpat convallis morbi odio odio,1,180,7
181,lobortis ligula sit amet eleifend pede libero quis orci nullam molestie nibh in lectus,3,181,2
182,ipsum primis in faucibus orci luctus et ultrices posuere cubilia curae donec,13,182,19
183,erat quisque erat eros viverra eget congue eget semper rutrum nulla nunc purus phasellus in felis donec semper,9,183,10
184,primis in faucibus orci luctus et ultrices posuere cubilia curae duis faucibus accumsan odio curabitur convallis duis consequat dui,20,184,6
185,fusce posuere felis sed lacus morbi sem mauris laoreet ut rhoncus aliquet pulvinar sed nisl nunc,12,185,13
186,proin eu mi nulla ac enim in tempor turpis nec euismod scelerisque quam turpis adipiscing lorem,19,186,7
187,rhoncus aliquet pulvinar sed nisl nunc rhoncus dui vel sem sed sagittis nam congue risus semper,9,187,17
188,ipsum primis in faucibus orci luctus et ultrices posuere cubilia curae mauris viverra diam vitae quam,10,188,20
189,vestibulum sed magna at nunc commodo placerat praesent blandit nam nulla integer pede justo lacinia,3,189,24
190,morbi non lectus aliquam sit amet diam in magna bibendum imperdiet nullam,19,190,9
191,duis bibendum morbi non quam nec dui luctus rutrum nulla tellus in,9,191,6
192,turpis donec posuere metus vitae ipsum aliquam non mauris morbi non lectus aliquam sit amet diam,14,192,18
193,ultrices posuere cubilia curae mauris viverra diam vitae quam suspendisse potenti nullam porttitor lacus at turpis donec posuere metus,3,193,10
194,blandit non interdum in ante vestibulum ante ipsum primis in,15,194,9
195,augue a suscipit nulla elit ac nulla sed vel enim sit amet nunc,16,195,24
196,augue aliquam erat volutpat in congue etiam justo etiam pretium iaculis justo,19,196,5
197,proin eu mi nulla ac enim in tempor turpis nec euismod scelerisque quam turpis adipiscing lorem vitae mattis nibh ligula,3,197,15
198,vitae nisl aenean lectus pellentesque eget nunc donec quis orci eget orci vehicula condimentum curabitur in libero ut massa,5,198,21
199,id luctus nec molestie sed justo pellentesque viverra pede ac diam cras pellentesque,5,199,1
200,penatibus et magnis dis parturient montes nascetur ridiculus mus etiam vel augue vestibulum rutrum rutrum neque aenean auctor,15,200,21
201,congue vivamus metus arcu adipiscing molestie hendrerit at vulputate vitae nisl aenean,8,201,16
202,sem mauris laoreet ut rhoncus aliquet pulvinar sed nisl nunc rhoncus,5,202,23
203,id luctus nec molestie sed justo pellentesque viverra pede ac diam cras,17,203,1
204,diam erat fermentum justo nec condimentum neque sapien placerat ante nulla justo aliquam quis turpis,19,204,14
205,dui vel sem sed sagittis nam congue risus semper porta volutpat quam pede lobortis ligula sit amet,8,205,18
206,non pretium quis lectus suspendisse potenti in eleifend quam a odio in hac habitasse platea dictumst maecenas,20,206,16
207,non lectus aliquam sit amet diam in magna bibendum imperdiet nullam orci pede venenatis non,6,207,4
208,malesuada in imperdiet et commodo vulputate justo in blandit ultrices enim lorem ipsum dolor,7,208,2
209,dolor sit amet consectetuer adipiscing elit proin interdum mauris non ligula,8,209,1
210,mi nulla ac enim in tempor turpis nec euismod scelerisque quam,1,210,14
211,justo morbi ut odio cras mi pede malesuada in imperdiet et,20,211,13
212,donec vitae nisi nam ultrices libero non mattis pulvinar nulla pede ullamcorper augue a,1,212,16
213,dolor sit amet consectetuer adipiscing elit proin risus praesent lectus vestibulum quam sapien varius ut blandit,11,213,20
214,lorem vitae mattis nibh ligula nec sem duis aliquam convallis nunc proin at,3,214,15
215,accumsan felis ut at dolor quis odio consequat varius integer,19,215,9
216,mauris viverra diam vitae quam suspendisse potenti nullam porttitor lacus,13,216,1
217,lacinia eget tincidunt eget tempus vel pede morbi porttitor lorem,18,217,13
218,vivamus vel nulla eget eros elementum pellentesque quisque porta volutpat erat quisque erat eros viverra eget congue eget semper rutrum,11,218,22
219,sapien cum sociis natoque penatibus et magnis dis parturient montes nascetur ridiculus mus etiam vel augue vestibulum,6,219,11
220,nisl ut volutpat sapien arcu sed augue aliquam erat volutpat in congue etiam justo etiam pretium iaculis justo,8,220,3
221,curabitur gravida nisi at nibh in hac habitasse platea dictumst aliquam augue quam,3,221,25
222,feugiat non pretium quis lectus suspendisse potenti in eleifend quam,8,222,14
223,id nulla ultrices aliquet maecenas leo odio condimentum id luctus nec molestie sed justo pellentesque viverra pede ac diam cras,4,223,11
224,molestie hendrerit at vulputate vitae nisl aenean lectus pellentesque eget nunc donec quis orci eget orci vehicula condimentum curabitur,4,224,15
225,mattis egestas metus aenean fermentum donec ut mauris eget massa tempor convallis nulla neque libero,4,225,19
226,feugiat et eros vestibulum ac est lacinia nisi venenatis tristique fusce congue diam id ornare imperdiet sapien urna,12,226,20
227,id mauris vulputate elementum nullam varius nulla facilisi cras non velit nec nisi vulputate nonummy maecenas,6,227,16
228,nullam sit amet turpis elementum ligula vehicula consequat morbi a ipsum integer a nibh,3,228,10
229,amet erat nulla tempus vivamus in felis eu sapien cursus vestibulum proin eu mi nulla ac enim in tempor turpis,14,229,23
230,morbi odio odio elementum eu interdum eu tincidunt in leo maecenas pulvinar lobortis,5,230,9
231,urna ut tellus nulla ut erat id mauris vulputate elementum nullam varius nulla facilisi cras non velit,10,231,22
232,odio porttitor id consequat in consequat ut nulla sed accumsan felis ut at dolor,3,232,7
233,aliquet ultrices erat tortor sollicitudin mi sit amet lobortis sapien sapien non mi integer,13,233,15
234,ut massa volutpat convallis morbi odio odio elementum eu interdum eu tincidunt in,8,234,11
235,quis orci nullam molestie nibh in lectus pellentesque at nulla suspendisse potenti cras in purus eu magna,7,235,7
236,nulla tempus vivamus in felis eu sapien cursus vestibulum proin eu mi nulla ac enim in,8,236,6
237,in leo maecenas pulvinar lobortis est phasellus sit amet erat nulla tempus vivamus in felis eu sapien,1,237,10
238,suspendisse potenti in eleifend quam a odio in hac habitasse platea dictumst maecenas ut massa quis,3,238,11
239,sit amet eros suspendisse accumsan tortor quis turpis sed ante vivamus tortor duis mattis egestas metus,9,239,13
240,tristique fusce congue diam id ornare imperdiet sapien urna pretium nisl ut volutpat sapien arcu sed augue aliquam,10,240,16
241,sit amet consectetuer adipiscing elit proin risus praesent lectus vestibulum,9,241,22
