404,404,5,amet sapien dignissim vestibulum vestibulum ante ipsum primis in faucibus orci luctus et ultrices posuere cubilia,2017-06-14 21:12:24,5
405,405,20,enim leo rhoncus sed vestibulum sit amet cursus id turpis integer aliquet massa id lobortis convallis tortor,2017-03-14 22:56:27,9
406,406,1,in congue etiam justo etiam pretium iaculis justo in hac habitasse platea dictumst etiam faucibus cursus urna ut tellus,2017-08-01 02:36:58,9
407,407,15,lectus suspendisse potenti in eleifend quam a odio in hac habitasse platea dictumst maecenas ut massa,2017-05-03 17:40:16,9
408,408,35,phasellus sit amet erat nulla tempus vivamus in felis eu sapien cursus vestibulum proin eu mi nulla ac enim,2017-07-19 05:31:24,8
409,409,91,luctus nec molestie sed justo pellentesque viverra pede ac diam cras pellentesque,2017-10-11 20:00:57,6
410,410,24,est et tempus semper est quam pharetra magna ac consequat metus sapien ut nunc vestibulum,2017-04-08 14:30:42,5
411,411,25,porttitor lorem id ligula suspendisse ornare consequat lectus in est risus auctor sed tristique,2017-10-10 01:49:48,4
412,412,7,tellus nisi eu orci mauris lacinia sapien quis libero nullam sit amet turpis elementum ligula vehicula,2017-09-30 01:43:08,9
413,413,64,dis parturient montes nascetur ridiculus mus etiam vel augue vestibulum,2017-08-25 15:07:11,6
414,414,10,id sapien in sapien iaculis congue vivamus metus arcu adipiscing molestie hendrerit at,2017-12-20 22:50:48,7
415,415,79,pede justo lacinia eget tincidunt eget tempus vel pede morbi porttitor lorem id ligula suspendisse,2017-06-15 04:16:15,8
416,416,64,eros elementum pellentesque quisque porta volutpat erat quisque erat eros viverra eget congue eget,2017-02-16 21:53:02,2
417,417,100,metus aenean fermentum donec ut mauris eget massa tempor convallis nulla neque libero convallis eget eleifend luctus,2017-12-01 09:22:38,6
418,418,13,nulla integer pede justo lacinia eget tincidunt eget tempus vel pede morbi porttitor lorem id ligula suspendisse ornare consequat,2018-02-06 17:10:26,6
419,419,64,habitasse platea dictumst maecenas ut massa quis augue luctus tincidunt nulla mollis molestie lorem quisque ut erat curabitur,2017-04-22 13:51:46,1
420,420,65,ac neque duis bibendum morbi non quam nec dui luctus rutrum nulla tellus in sagittis dui vel,2017-05-02 15:44:48,1
421,421,64,convallis nulla neque libero convallis eget eleifend luctus ultricies eu,2017-11-15 04:48:56,4
422,422,31,etiam faucibus cursus urna ut tellus nulla ut erat id mauris vulputate elementum nullam varius nulla,2017-04-21 14:00:10,4
423,423,17,nam dui proin leo odio porttitor id consequat in consequat ut nulla sed accumsan felis ut at dolor quis,2017-08-31 04:35:30,4
424,424,6,a odio in hac habitasse platea dictumst maecenas ut massa quis augue luctus tincidunt nulla mollis molestie,2017-06-30 19:23:58,4
425,425,85,venenatis lacinia aenean sit amet justo morbi ut odio cras mi pede malesuada in imperdiet et commodo vulputate,2017-11-05 22:07:29,1
426,426,30,nisl duis ac nibh fusce lacus purus aliquet at feugiat non pretium quis lectus suspendisse potenti in eleifend quam,2017-08-22 11:55:06,4
427,427,8,vivamus metus arcu adipiscing molestie hendrerit at vulputate vitae nisl aenean lectus pellentesque eget nunc,2017-04-11 18:38:40,8
428,428,91,velit donec diam neque vestibulum eget vulputate ut ultrices vel augue vestibulum ante,2017-02-09 08:38:22,4
429,429,45,porttitor lacus at turpis donec posuere metus vitae ipsum aliquam non mauris,2017-11-25 01:15:53,1
430,430,94,cras pellentesque volutpat dui maecenas tristique est et tempus semper est quam pharetra magna ac consequat metus,2017-02-13 16:53:48,5
431,431,49,euismod scelerisque quam turpis adipiscing lorem vitae mattis nibh ligula,2017-08-19 09:19:03,2
432,432,6,semper est quam pharetra magna ac consequat metus sapien ut nunc vestibulum ante ipsum primis in faucibus orci luctus et,2017-03-11 05:22:23,8
433,433,74,pellentesque eget nunc donec quis orci eget orci vehicula condimentum curabitur in libero ut,2017-11-28 21:08:45,2
434,434,13,lacinia aenean sit amet justo morbi ut odio cras mi pede malesuada in imperdiet et commodo vulputate justo in,2018-01-26 07:55:53,4
435,435,28,pede morbi porttitor lorem id ligula suspendisse ornare consequat lectus in est risus auctor sed tristique in tempus sit,2017-07-07 11:01:30,6
436,436,74,aliquam sit amet diam in magna bibendum imperdiet nullam orci pede venenatis non sodales,2017-08-29 03:59:49,8
437,437,56,risus dapibus augue vel accumsan tellus nisi eu orci mauris lacinia sapien,2017-08-15 12:19:36,5
438,438,30,magna ac consequat metus sapien ut nunc vestibulum ante ipsum primis in faucibus orci luctus et ultrices posuere cubilia curae,2017-12-25 09:12:13,1
439,439,62,sit amet erat nulla tempus vivamus in felis eu sapien cursus vestibulum proin eu,2017-02-12 07:01:05,5
440,440,65,malesuada in imperdiet et commodo vulputate justo in blandit ultrices enim lorem ipsum dolor,2017-11-02 15:47:53,6
441,441,46,sed ante vivamus tortor duis mattis egestas metus aenean fermentum,2017-08-20 05:57:56,1
442,442,78,nascetur ridiculus mus vivamus vestibulum sagittis sapien cum sociis natoque penatibus,2017-03-14 04:43:11,4
443,443,84,ipsum primis in faucibus orci luctus et ultrices posuere cubilia curae,2017-07-04 08:58:51,4
444,444,83,luctus cum sociis natoque penatibus et magnis dis parturient montes,2017-08-08 09:33:46,6
445,445,33,vel est donec odio justo sollicitudin ut suscipit a feugiat et,2017-04-07 12:27:47,3
446,446,66,sed justo pellentesque viverra pede ac diam cras pellentesque volutpat dui maecenas tristique est et tempus,2017-03-14 22:55:47,8
447,447,22,pellentesque viverra pede ac diam cras pellentesque volutpat dui maecenas tristique est et tempus semper,2017-06-05 21:23:14,8
448,448,46,urna pretium nisl ut volutpat sapien arcu sed augue aliquam erat volutpat in congue etiam justo etiam pretium iaculis justo,2017-06-10 05:45:36,6
449,449,76,donec semper sapien a libero nam dui proin leo odio porttitor id consequat in consequat ut nulla sed,2017-08-03 04:13:46,9
450,450,11,interdum mauris non ligula pellentesque ultrices phasellus id sapien in sapien iaculis congue vivamus metus arcu adipiscing,2017-10-29 19:43:04,5
451,451,25,morbi porttitor lorem id ligula suspendisse ornare consequat lectus in est risus auctor sed tristique in tempus sit,2017-08-25 23:14:30,3
452,452,38,amet turpis elementum ligula vehicula consequat morbi a ipsum integer a nibh in quis justo,2018-01-28 18:41:58,1
453,453,25,vulputate ut ultrices vel augue vestibulum ante ipsum primis in faucibus orci luctus,2017-07-20 01:26:09,7
454,454,97,condimentum curabitur in libero ut massa volutpat convallis morbi odio odio elementum,2017-09-14 21:52:40,9
455,455,84,non interdum in ante vestibulum ante ipsum primis in faucibus orci luctus et ultrices posuere cubilia,2017-07-08 04:36:42,6
456,456,34,sapien varius ut blandit non interdum in ante vestibulum ante ipsum primis in faucibus orci luctus,2018-01-24 06:01:00,4
457,457,19,sit amet eros suspendisse accumsan tortor quis turpis sed ante vivamus tortor,2017-10-10 05:51:49,4
458,458,93,at velit eu est congue elementum in hac habitasse platea dictumst morbi vestibulum velit id pretium iaculis,2017-02-18 16:12:44,2
459,459,92,cubilia curae mauris viverra diam vitae quam suspendisse potenti nullam porttitor lacus at turpis donec,2017-02-20 04:46:45,4
460,460,93,ut erat curabitur gravida nisi at nibh in hac habitasse platea dictumst aliquam augue quam sollicitudin vitae,2017-10-01 01:04:05,7
461,461,1,platea dictumst etiam faucibus cursus urna ut tellus nulla ut erat id mauris,2017-11-14 03:01:17,6
462,462,74,quisque erat eros viverra eget congue eget semper rutrum nulla nunc purus phasellus in felis donec,2017-02-26 21:36:03,7
463,463,17,consequat metus sapien ut nunc vestibulum ante ipsum primis in faucibus orci luctus et ultrices,2017-06-13 02:20:10,5
464,464,89,libero nam dui proin leo odio porttitor id consequat in consequat ut,2017-03-06 01:56:27,5
465,465,16,fusce congue diam id ornare imperdiet sapien urna pretium nisl ut volutpat sapien arcu sed augue aliquam erat volutpat,2017-07-25 18:32:48,9
466,466,44,arcu adipiscing molestie hendrerit at vulputate vitae nisl aenean lectus,2017-10-19 02:37:55,8
467,467,69,lobortis convallis tortor risus dapibus augue vel accumsan tellus nisi eu orci mauris lacinia sapien quis libero,2017-07-10 04:37:13,2
468,468,76,a nibh in quis justo maecenas rhoncus aliquam lacus morbi quis tortor id nulla ultrices aliquet maecenas leo odio,2017-06-16 21:35:21,1
469,469,6,et magnis dis parturient montes nascetur ridiculus mus vivamus vestibulum sagittis sapien,2017-04-12 07:29:57,8
470,470,32,nisi vulputate nonummy maecenas tincidunt lacus at velit vivamus vel nulla eget,2017-07-07 13:32:31,7
471,471,41,sed ante vivamus tortor duis mattis egestas metus aenean fermentum donec ut mauris eget massa tempor convallis nulla neque libero,2017-03-02 05:06:42,2
472,472,76,volutpat convallis morbi odio odio elementum eu interdum eu tincidunt in leo maecenas pulvinar lobortis est,2018-01-20 09:30:48,7
473,473,10,erat volutpat in congue etiam justo etiam pretium iaculis justo in hac,2017-12-26 13:56:56,7
474,474,29,interdum venenatis turpis enim blandit mi in porttitor pede justo eu massa donec dapibus duis at velit eu est congue,2017-06-09 16:52:02,2
475,475,59,viverra pede ac diam cras pellentesque volutpat dui maecenas tristique est et tempus semper est quam pharetra magna ac consequat,2017-09-29 18:06:50,9
476,476,63,cubilia curae duis faucibus accumsan odio curabitur convallis duis consequat dui nec nisi,2017-05-19 06:35:24,6
477,477,72,praesent lectus vestibulum quam sapien varius ut blandit non interdum in ante vestibulum ante ipsum primis,2017-10-02 18:46:25,3
478,478,3,sapien quis libero nullam sit amet turpis elementum ligula vehicula consequat,2018-01-12 12:05:29,7
479,479,9,lectus aliquam sit amet diam in magna bibendum imperdiet nullam orci pede venenatis non sodales sed tincidunt eu felis fusce,2017-10-27 01:19:35,1
480,480,3,euismod scelerisque quam turpis adipiscing lorem vitae mattis nibh ligula nec sem duis aliquam convallis nunc proin at,2017-03-10 16:17:27,4
481,481,65,eu nibh quisque id justo sit amet sapien dignissim vestibulum,2017-03-05 02:46:09,3
482,482,77,facilisi cras non velit nec nisi vulputate nonummy maecenas tincidunt lacus at velit vivamus vel nulla eget,2018-02-02 21:50:40,9
483,483,13,faucibus orci luctus et ultrices posuere cubilia curae duis faucibus accumsan odio curabitur convallis duis consequat dui nec nisi volutpat,2017-07-06 09:19:02,6
484,484,65,dolor sit amet consectetuer adipiscing elit proin risus praesent lectus vestibulum quam sapien varius ut blandit non interdum in,2017-06-06 17:27:51,3
485,485,15,eget congue eget semper rutrum nulla nunc purus phasellus in felis donec,2017-12-10 18:40:54,4
486,486,38,in consequat ut nulla sed accumsan felis ut at dolor quis odio,2017-11-26 00:19:38,9
487,487,86,augue a suscipit nulla elit ac nulla sed vel enim sit amet nunc viverra dapibus nulla suscipit ligula in,2017-06-19 20:18:31,7
488,488,13,eu interdum eu tincidunt in leo maecenas pulvinar lobortis est phasellus sit amet,2017-11-27 10:43:01,9
489,489,4,diam erat fermentum justo nec condimentum neque sapien placerat ante nulla justo aliquam quis,2017-09-05 03:00:00,1
490,490,100,maecenas ut massa quis augue luctus tincidunt nulla mollis molestie lorem quisque ut erat,2017-08-01 15:15:26,1
491,491,92,curabitur at ipsum ac tellus semper interdum mauris ullamcorper purus,2018-01-13 09:49:26,1
492,492,100,tempor convallis nulla neque libero convallis eget eleifend luctus ultricies eu nibh quisque id justo,2018-01-27 23:39:01,9
493,493,98,rutrum nulla tellus in sagittis dui vel nisl duis ac nibh fusce lacus purus aliquet at feugiat non pretium quis,2017-02-16 17:39:33,9
494,494,18,sodales sed tincidunt eu felis fusce posuere felis sed lacus morbi sem mauris laoreet ut,2017-04-29 19:44:01,6
495,495,72,ultrices posuere cubilia curae donec pharetra magna vestibulum aliquet ultrices erat tortor sollicitudin mi sit amet lobortis,2017-12-17 15:25:35,9
496,496,90,tincidunt eu felis fusce posuere felis sed lacus morbi sem mauris laoreet ut rhoncus aliquet pulvinar sed nisl nunc,2017-03-10 00:11:59,1
497,497,33,rhoncus aliquam lacus morbi quis tortor id nulla ultrices aliquet maecenas leo,2017-11-02 20:30:44,3
498,498,93,molestie sed justo pellentesque viverra pede ac diam cras pellentesque volutpat,2017-07-30 07:10:07,6
499,499,41,facilisi cras non velit nec nisi vulputate nonummy maecenas tincidunt lacus at velit vivamus vel nulla eget eros elementum,2017-07-14 13:49:51,2
500,500,78,eleifend luctus ultricies eu nibh quisque id justo sit amet sapien,2017-03-02 01:44:53,9
501,501,82,integer non velit donec diam neque vestibulum eget vulputate ut ultrices,2017-08-10 05:06:08,2
502,502,39,eu sapien cursus vestibulum proin eu mi nulla ac enim in tempor turpis nec euismod scelerisque quam,2017-05-26 19:14:59,1
503,503,44,cursus urna ut tellus nulla ut erat id mauris vulputate elementum nullam varius nulla facilisi cras non velit nec,2017-09-26 01:19:15,9
504,504,46,aliquam quis turpis eget elit sodales scelerisque mauris sit amet eros suspendisse accumsan tortor quis turpis,2017-07-03 11:55:48,6
505,505,38,tempor convallis nulla neque libero convallis eget eleifend luctus ultricies eu nibh quisque id justo sit amet sapien dignissim vestibulum,2017-09-25 15:19:57,3
506,506,52,nullam sit amet turpis elementum ligula vehicula consequat morbi a ipsum integer a nibh in quis justo maecenas rhoncus,2017-07-05 13:52:44,3
507,507,70,etiam justo etiam pretium iaculis justo in hac habitasse platea dictumst etiam faucibus cursus urna ut tellus nulla ut,2018-01-05 17:17:27,6
508,508,13,mauris vulputate elementum nullam varius nulla facilisi cras non velit nec nisi vulputate nonummy maecenas tincidunt lacus at,2017-11-18 20:08:23,2
509,509,55,mauris viverra diam vitae quam suspendisse potenti nullam porttitor lacus at turpis donec posuere metus vitae ipsum,2017-10-31 14:42:00,3
510,510,24,non mi integer ac neque duis bibendum morbi non quam nec dui luctus rutrum nulla,2017-06-11 05:43:19,7
511,511,46,adipiscing lorem vitae mattis nibh ligula nec sem duis aliquam convallis nunc proin at,2018-01-17 19:36:02,8
512,512,74,quis justo maecenas rhoncus aliquam lacus morbi quis tortor id nulla ultrices aliquet maecenas leo odio condimentum id,2017-02-24 13:55:33,6
513,513,33,convallis duis consequat dui nec nisi volutpat eleifend donec ut dolor morbi,2017-08-16 20:07:52,3
514,514,11,aliquam non mauris morbi non lectus aliquam sit amet diam in magna bibendum imperdiet nullam orci,2017-09-12 06:29:27,4
515,515,4,dapibus augue vel accumsan tellus nisi eu orci mauris lacinia sapien quis libero nullam sit amet turpis elementum ligula,2017-06-24 06:27:32,7
516,516,61,nam nulla integer pede justo lacinia eget tincidunt eget tempus vel pede morbi porttitor lorem id,2017-09-11 08:50:45,6
517,517,92,nulla tempus vivamus in felis eu sapien cursus vestibulum proin eu mi nulla ac,2017-05-11 08:02:55,4
518,518,40,non velit nec nisi vulputate nonummy maecenas tincidunt lacus at velit vivamus vel nulla eget eros elementum pellentesque quisque porta,2017-08-05 11:32:39,8
519,519,73,proin leo odio porttitor id consequat in consequat ut nulla sed accumsan felis ut at,2017-08-30 13:46:35,1
520,520,18,nisl nunc nisl duis bibendum felis sed interdum venenatis turpis enim blandit mi in porttitor pede,2017-12-20 06:10:08,6
521,521,76,sed lacus morbi sem mauris laoreet ut rhoncus aliquet pulvinar sed nisl nunc rhoncus dui,2018-02-02 10:28:34,3
522,522,71,nisi vulputate nonummy maecenas tincidunt lacus at velit vivamus vel nulla eget eros elementum pellentesque quisque porta,2017-05-25 03:03:04,8
523,523,46,ultrices posuere cubilia curae donec pharetra magna vestibulum aliquet ultrices erat tortor sollicitudin mi,2017-05-09 23:43:37,4
524,524,44,in felis donec semper sapien a libero nam dui proin leo odio,2018-01-03 02:55:01,6
525,525,74,eu mi nulla ac enim in tempor turpis nec euismod scelerisque quam turpis,2017-11-20 21:42:12,1
526,526,45,vehicula condimentum curabitur in libero ut massa volutpat convallis morbi odio odio elementum eu,2017-11-06 07:22:03,6
527,527,59,morbi quis tortor id nulla ultrices aliquet maecenas leo odio condimentum id luctus,2017-02-08 03:06:56,2
528,528,98,quam turpis adipiscing lorem vitae mattis nibh ligula nec sem duis aliquam convallis nunc proin at turpis a pede,2017-09-07 07:10:32,8
529,529,81,non mauris morbi non lectus aliquam sit amet diam in magna bibendum imperdiet nullam orci pede,2018-01-31 16:22:18,3
530,530,65,a ipsum integer a nibh in quis justo maecenas rhoncus aliquam lacus morbi quis tortor id nulla ultrices aliquet maecenas,2017-12-07 14:13:27,6
531,531,98,mi pede malesuada in imperdiet et commodo vulputate justo in blandit,2017-07-14 17:04:16,7
532,532,50,nonummy integer non velit donec diam neque vestibulum eget vulputate ut ultrices vel,2017-12-25 13:23:34,2
533,533,80,massa id nisl venenatis lacinia aenean sit amet justo morbi ut odio cras mi pede malesuada in imperdiet,2017-07-15 07:52:43,1
534,534,84,erat curabitur gravida nisi at nibh in hac habitasse platea dictumst aliquam augue quam sollicitudin,2017-07-26 12:11:02,3
535,535,35,etiam faucibus cursus urna ut tellus nulla ut erat id mauris vulputate elementum nullam varius nulla,2017-03-20 19:34:17,4
536,536,89,curae donec pharetra magna vestibulum aliquet ultrices erat tortor sollicitudin mi sit amet lobortis sapien sapien non mi integer,2018-01-23 22:34:58,3
537,537,31,diam id ornare imperdiet sapien urna pretium nisl ut volutpat sapien arcu sed,2018-02-06 12:01:03,4
538,538,38,auctor sed tristique in tempus sit amet sem fusce consequat nulla nisl,2017-08-01 14:29:09,1
539,539,97,nec dui luctus rutrum nulla tellus in sagittis dui vel nisl duis,2017-03-25 19:03:21,5
540,540,38,adipiscing elit proin interdum mauris non ligula pellentesque ultrices phasellus id sapien in sapien,2017-07-29 20:12:25,4
541,541,35,convallis duis consequat dui nec nisi volutpat eleifend donec ut dolor,2017-08-31 07:59:06,5
542,542,26,quisque arcu libero rutrum ac lobortis vel dapibus at diam nam tristique tortor eu pede,2017-04-02 09:12:40,7
543,543,24,eu orci mauris lacinia sapien quis libero nullam sit amet turpis elementum ligula vehicula consequat morbi a ipsum integer a,2017-04-21 07:38:05,7
544,544,13,eu massa donec dapibus duis at velit eu est congue elementum in hac,2017-07-08 10:24:35,8
545,545,69,sed interdum venenatis turpis enim blandit mi in porttitor pede justo eu massa donec dapibus,2017-06-06 05:56:25,4
546,546,94,lacinia nisi venenatis tristique fusce congue diam id ornare imperdiet sapien urna pretium nisl ut,2017-03-01 21:46:40,4
547,547,76,consequat in consequat ut nulla sed accumsan felis ut at dolor quis odio consequat varius integer,2017-02-28 12:35:30,4
548,548,59,massa quis augue luctus tincidunt nulla mollis molestie lorem quisque ut erat curabitur gravida,2017-12-29 08:48:57,8
549,549,67,mauris morbi non lectus aliquam sit amet diam in magna bibendum imperdiet nullam,2017-02-17 06:06:12,1
550,550,57,nam ultrices libero non mattis pulvinar nulla pede ullamcorper augue a suscipit nulla elit ac nulla,2017-11-17 22:01:20,4
551,551,78,cursus id turpis integer aliquet massa id lobortis convallis tortor risus dapibus augue vel accumsan tellus nisi eu,2017-12-02 01:41:36,6
552,552,31,quis justo maecenas rhoncus aliquam lacus morbi quis tortor id nulla ultrices aliquet maecenas,2017-07-11 06:03:45,5
553,553,43,proin eu mi nulla ac enim in tempor turpis nec euismod,2017-07-11 12:35:25,7
554,554,57,mauris viverra diam vitae quam suspendisse potenti nullam porttitor lacus at turpis donec posuere metus vitae ipsum aliquam non,2017-12-05 11:43:42,5
555,555,14,fringilla rhoncus mauris enim leo rhoncus sed vestibulum sit amet cursus id turpis integer aliquet,2018-02-01 00:28:54,1
556,556,70,venenatis non sodales sed tincidunt eu felis fusce posuere felis sed lacus morbi sem mauris laoreet ut rhoncus,2017-03-07 22:48:04,3
557,557,93,tristique in tempus sit amet sem fusce consequat nulla nisl nunc nisl duis bibendum felis sed interdum venenatis,2017-04-26 06:14:09,2
558,558,38,nullam sit amet turpis elementum ligula vehicula consequat morbi a ipsum integer a nibh in quis justo maecenas rhoncus,2017-05-23 19:17:39,7
559,559,60,odio condimentum id luctus nec molestie sed justo pellentesque viverra,2017-08-22 15:41:04,7
560,560,34,sapien cum sociis natoque penatibus et magnis dis parturient montes nascetur,2017-02-28 16:16:11,8
561,561,59,lectus in est risus auctor sed tristique in tempus sit amet sem fusce consequat nulla nisl nunc nisl,2017-09-10 05:11:28,2
562,562,6,vestibulum vestibulum ante ipsum primis in faucibus orci luctus et ultrices posuere cubilia,2017-03-08 06:30:05,6
563,563,17,ac lobortis vel dapibus at diam nam tristique tortor eu pede,2017-11-06 14:37:02,4
564,564,37,dis parturient montes nascetur ridiculus mus etiam vel augue vestibulum rutrum rutrum neque aenean auctor gravida sem praesent,2017-06-29 13:50:24,1
565,565,31,amet diam in magna bibendum imperdiet nullam orci pede venenatis non sodales sed tincidunt eu felis fusce posuere,2017-08-19 02:07:34,1
566,566,58,nulla tempus vivamus in felis eu sapien cursus vestibulum proin eu mi nulla ac enim,2017-03-26 09:09:01,4
567,567,43,ipsum primis in faucibus orci luctus et ultrices posuere cubilia curae donec pharetra magna vestibulum,2017-12-08 14:55:59,4
568,568,56,fermentum justo nec condimentum neque sapien placerat ante nulla justo aliquam quis,2017-07-03 07:11:03,5
569,569,18,maecenas pulvinar lobortis est phasellus sit amet erat nulla tempus vivamus in felis eu sapien,2017-06-13 07:37:16,5
570,570,75,ligula nec sem duis aliquam convallis nunc proin at turpis a pede posuere nonummy,2017-10-25 14:50:32,5
571,571,70,nisl nunc nisl duis bibendum felis sed interdum venenatis turpis enim blandit,2017-05-25 04:26:55,7
572,572,59,lacus morbi quis tortor id nulla ultrices aliquet maecenas leo odio condimentum id luctus nec molestie,2017-08-01 23:49:04,5
573,573,28,posuere cubilia curae donec pharetra magna vestibulum aliquet ultrices erat tortor sollicitudin mi sit amet,2017-03-17 01:26:52,9
574,574,80,amet justo morbi ut odio cras mi pede malesuada in imperdiet et,2017-10-01 05:17:40,2
575,575,63,pretium nisl ut volutpat sapien arcu sed augue aliquam erat volutpat in congue etiam justo etiam pretium iaculis justo in,2017-10-13 14:15:31,4
576,576,81,placerat praesent blandit nam nulla integer pede justo lacinia eget tincidunt eget,2017-05-01 15:45:12,4
577,577,57,feugiat non pretium quis lectus suspendisse potenti in eleifend quam a odio in,2017-08-22 10:52:13,6
578,578,79,viverra dapibus nulla suscipit ligula in lacus curabitur at ipsum ac tellus semper interdum mauris ullamcorper purus sit amet,2018-01-06 19:20:46,6
579,579,61,non mi integer ac neque duis bibendum morbi non quam nec dui luctus rutrum nulla tellus in sagittis,2017-12-16 09:28:30,5
580,580,32,diam in magna bibendum imperdiet nullam orci pede venenatis non sodales sed tincidunt,2017-09-05 04:38:48,8
581,581,73,vulputate nonummy maecenas tincidunt lacus at velit vivamus vel nulla,2017-07-06 19:17:26,5
582,582,88,quisque erat eros viverra eget congue eget semper rutrum nulla nunc purus,2018-01-12 14:27:37,1
583,583,22,ipsum dolor sit amet consectetuer adipiscing elit proin interdum mauris non ligula pellentesque ultrices phasellus id sapien in,2017-12-26 23:46:32,1
584,584,90,habitasse platea dictumst morbi vestibulum velit id pretium iaculis diam erat,2017-11-12 16:54:51,9
585,585,38,id nulla ultrices aliquet maecenas leo odio condimentum id luctus nec molestie sed justo pellentesque viverra,2017-08-21 18:40:01,9
586,586,64,viverra dapibus nulla suscipit ligula in lacus curabitur at ipsum ac tellus semper interdum mauris ullamcorper purus sit amet nulla,2017-08-07 13:28:13,5
587,587,16,vel ipsum praesent blandit lacinia erat vestibulum sed magna at nunc commodo placerat praesent blandit nam nulla integer,2017-11-07 16:18:52,3
588,588,86,nisi nam ultrices libero non mattis pulvinar nulla pede ullamcorper augue,2017-09-24 13:10:48,8
589,589,58,luctus ultricies eu nibh quisque id justo sit amet sapien,2017-08-28 18:00:46,8
590,590,97,nunc proin at turpis a pede posuere nonummy integer non velit donec diam neque vestibulum eget vulputate ut ultrices,2017-08-03 19:24:04,6
591,591,49,neque libero convallis eget eleifend luctus ultricies eu nibh quisque,2017-09-27 20:15:39,4
592,592,77,vehicula consequat morbi a ipsum integer a nibh in quis justo maecenas rhoncus aliquam lacus morbi,2017-02-24 17:10:44,7
593,593,86,rutrum at lorem integer tincidunt ante vel ipsum praesent blandit lacinia erat vestibulum sed magna at nunc,2017-03-13 13:27:07,6
594,594,1,integer ac neque duis bibendum morbi non quam nec dui luctus rutrum nulla tellus in sagittis dui vel nisl,2017-03-04 06:56:51,8
595,595,98,semper porta volutpat quam pede lobortis ligula sit amet eleifend,2018-02-01 18:32:05,9
596,596,51,eu tincidunt in leo maecenas pulvinar lobortis est phasellus sit amet erat nulla tempus vivamus in felis eu,2017-04-23 06:21:45,3
597,597,79,interdum in ante vestibulum ante ipsum primis in faucibus orci luctus et ultrices posuere cubilia curae duis faucibus accumsan odio,2017-02-08 18:22:01,7
598,598,96,feugiat non pretium quis lectus suspendisse potenti in eleifend quam,2017-03-11 11:59:29,1
599,599,93,in tempus sit amet sem fusce consequat nulla nisl nunc nisl duis bibendum felis sed,2018-01-01 03:34:57,6
600,600,26,mauris eget massa tempor convallis nulla neque libero convallis eget eleifend luctus ultricies eu nibh quisque id justo,2017-08-24 23:28:03,7
601,601,72,congue etiam justo etiam pretium iaculis justo in hac habitasse,2017-10-31 01:13:39,7
602,602,12,diam neque vestibulum eget vulputate ut ultrices vel augue vestibulum ante ipsum primis in faucibus orci luctus et ultrices posuere,2017-05-18 08:56:53,4
