603,603,56,pulvinar sed nisl nunc rhoncus dui vel sem sed sagittis nam congue risus semper porta volutpat quam pede lobortis,2017-08-12 05:41:09,6
604,604,80,ut mauris eget massa tempor convallis nulla neque libero convallis eget eleifend luctus ultricies eu nibh,2017-08-19 22:43:31,1
605,605,43,ut rhoncus aliquet pulvinar sed nisl nunc rhoncus dui vel sem sed,2017-05-20 07:17:29,2
606,606,45,hendrerit at vulputate vitae nisl aenean lectus pellentesque eget nunc donec quis orci eget orci vehicula condimentum curabitur in,2018-01-07 05:58:10,2
607,607,7,proin risus praesent lectus vestibulum quam sapien varius ut blandit non interdum in ante vestibulum ante ipsum primis in,2017-07-15 17:49:31,8
608,608,58,sed tristique in tempus sit amet sem fusce consequat nulla nisl nunc nisl duis bibendum felis sed interdum,2017-11-16 16:16:30,9
609,609,62,ultrices libero non mattis pulvinar nulla pede ullamcorper augue a,2017-11-26 12:51:40,6
610,610,9,vulputate elementum nullam varius nulla facilisi cras non velit nec,2017-10-02 04:30:26,2
611,611,42,et commodo vulputate justo in blandit ultrices enim lorem ipsum,2017-10-14 04:35:33,2
612,612,81,sit amet consectetuer adipiscing elit proin interdum mauris non ligula pellentesque ultrices phasellus id,2017-06-02 03:52:37,1
613,613,92,non sodales sed tincidunt eu felis fusce posuere felis sed lacus morbi sem mauris laoreet ut rhoncus,2017-12-13 08:51:10,3
614,614,16,eu felis fusce posuere felis sed lacus morbi sem mauris laoreet ut rhoncus aliquet pulvinar sed nisl,2017-10-21 18:51:15,6
615,615,39,cursus id turpis integer aliquet massa id lobortis convallis tortor risus dapibus augue,2017-08-15 15:46:06,3
616,616,30,molestie sed justo pellentesque viverra pede ac diam cras pellentesque volutpat dui maecenas tristique est et tempus semper est,2017-11-21 13:03:29,4
617,617,77,sit amet nulla quisque arcu libero rutrum ac lobortis vel dapibus at,2017-08-09 15:36:51,4
618,618,4,sit amet consectetuer adipiscing elit proin risus praesent lectus vestibulum quam sapien,2017-08-08 23:31:11,2
619,619,82,consectetuer adipiscing elit proin interdum mauris non ligula pellentesque ultrices phasellus id sapien in sapien iaculis congue,2017-07-29 05:24:31,4
620,620,23,pellentesque volutpat dui maecenas tristique est et tempus semper est quam pharetra magna ac consequat metus sapien,2018-01-01 08:36:31,7
621,621,3,aenean fermentum donec ut mauris eget massa tempor convallis nulla,2017-09-24 06:31:32,8
622,622,89,viverra eget congue eget semper rutrum nulla nunc purus phasellus,2017-09-28 20:42:51,6
623,623,47,risus dapibus augue vel accumsan tellus nisi eu orci mauris lacinia sapien quis,2017-03-30 20:33:50,2
624,624,93,diam neque vestibulum eget vulputate ut ultrices vel augue vestibulum ante ipsum primis in faucibus,2017-02-12 04:02:17,1
625,625,48,est congue elementum in hac habitasse platea dictumst morbi vestibulum velit id pretium iaculis diam erat fermentum justo nec,2018-01-12 11:33:39,5
626,626,3,dictumst aliquam augue quam sollicitudin vitae consectetuer eget rutrum at lorem integer,2017-08-20 18:09:46,5
627,627,16,congue risus semper porta volutpat quam pede lobortis ligula sit amet eleifend pede libero,2017-08-30 14:40:16,5
628,628,7,sed accumsan felis ut at dolor quis odio consequat varius integer ac leo pellentesque ultrices mattis odio,2017-03-26 07:39:25,2
629,629,4,turpis adipiscing lorem vitae mattis nibh ligula nec sem duis aliquam convallis nunc proin at turpis a pede posuere,2017-07-11 16:02:06,4
630,630,70,volutpat in congue etiam justo etiam pretium iaculis justo in hac habitasse,2017-12-25 12:58:01,1
631,631,66,interdum eu tincidunt in leo maecenas pulvinar lobortis est phasellus sit,2017-08-09 01:38:39,6
632,632,3,phasellus in felis donec semper sapien a libero nam dui proin leo,2017-10-29 20:17:04,6
633,633,1,lorem quisque ut erat curabitur gravida nisi at nibh in hac habitasse platea dictumst aliquam augue quam sollicitudin vitae,2018-01-20 18:10:45,6
634,634,50,blandit lacinia erat vestibulum sed magna at nunc commodo placerat,2017-04-15 23:52:54,4
635,635,77,aenean sit amet justo morbi ut odio cras mi pede malesuada in imperdiet et commodo vulputate justo in blandit,2017-09-28 07:19:31,8
636,636,93,donec dapibus duis at velit eu est congue elementum in,2017-04-15 20:04:59,8
637,637,76,ut odio cras mi pede malesuada in imperdiet et commodo vulputate justo,2017-12-19 02:13:03,2
