206,206,17,ipsum dolor sit amet consectetuer adipiscing elit proin interdum mauris non ligula pellentesque ultrices phasellus id sapien in,2017-09-16 21:32:59,8
207,207,93,orci mauris lacinia sapien quis libero nullam sit amet turpis elementum ligula vehicula consequat morbi,2017-10-27 21:08:41,9
208,208,17,felis donec semper sapien a libero nam dui proin leo odio porttitor id consequat in consequat ut nulla,2017-04-27 00:30:39,8
209,209,52,sit amet eleifend pede libero quis orci nullam molestie nibh,2017-08-20 20:59:10,1
210,210,57,mattis egestas metus aenean fermentum donec ut mauris eget massa tempor convallis,2018-01-31 19:39:55,5
211,211,49,donec odio justo sollicitudin ut suscipit a feugiat et eros vestibulum,2017-09-14 13:46:10,9
212,212,99,aliquet at feugiat non pretium quis lectus suspendisse potenti in,2017-05-01 19:45:03,4
213,213,90,nibh in quis justo maecenas rhoncus aliquam lacus morbi quis tortor id nulla ultrices aliquet,2017-04-28 15:42:46,9
214,214,20,vel pede morbi porttitor lorem id ligula suspendisse ornare consequat,2017-12-26 15:40:10,4
215,215,61,id sapien in sapien iaculis congue vivamus metus arcu adipiscing molestie hendrerit at vulputate vitae nisl aenean lectus pellentesque,2017-04-22 03:31:14,9
216,216,65,bibendum morbi non quam nec dui luctus rutrum nulla tellus in sagittis dui vel nisl duis ac nibh,2017-09-08 05:16:08,2
217,217,49,hac habitasse platea dictumst maecenas ut massa quis augue luctus tincidunt nulla mollis molestie lorem quisque ut,2018-01-06 03:48:03,9
218,218,41,turpis donec posuere metus vitae ipsum aliquam non mauris morbi non lectus aliquam sit amet diam in magna,2017-05-09 18:10:18,2
219,219,87,sed interdum venenatis turpis enim blandit mi in porttitor pede justo eu massa donec dapibus duis at velit eu est,2017-04-05 05:35:54,7
220,220,64,metus vitae ipsum aliquam non mauris morbi non lectus aliquam sit amet diam in magna bibendum imperdiet,2017-12-01 00:45:59,7
221,221,4,commodo vulputate justo in blandit ultrices enim lorem ipsum dolor,2017-11-07 13:56:18,2
222,222,91,bibendum morbi non quam nec dui luctus rutrum nulla tellus in sagittis,2017-05-15 10:28:54,2
223,223,43,ullamcorper purus sit amet nulla quisque arcu libero rutrum ac lobortis vel dapibus at diam nam tristique tortor eu,2017-10-24 09:31:03,7
224,224,85,nulla suspendisse potenti cras in purus eu magna vulputate luctus cum sociis natoque penatibus et magnis,2017-02-10 17:15:53,3
225,225,47,bibendum felis sed interdum venenatis turpis enim blandit mi in porttitor pede,2017-04-27 03:44:14,3
226,226,95,natoque penatibus et magnis dis parturient montes nascetur ridiculus mus vivamus vestibulum,2018-01-29 06:55:01,6
227,227,56,amet eleifend pede libero quis orci nullam molestie nibh in lectus pellentesque at nulla suspendisse,2017-08-05 14:45:04,9
228,228,93,nibh quisque id justo sit amet sapien dignissim vestibulum vestibulum ante ipsum primis,2017-10-26 18:38:23,8
229,229,28,lacinia aenean sit amet justo morbi ut odio cras mi pede malesuada in imperdiet et commodo vulputate justo in,2017-09-27 10:34:50,9
230,230,12,id mauris vulputate elementum nullam varius nulla facilisi cras non velit nec nisi vulputate nonummy maecenas tincidunt lacus,2018-01-09 05:16:26,1
231,231,73,consectetuer adipiscing elit proin risus praesent lectus vestibulum quam sapien varius ut blandit non interdum,2018-01-07 12:15:36,3
232,232,6,vulputate justo in blandit ultrices enim lorem ipsum dolor sit,2017-04-19 21:02:58,8
233,233,18,integer ac neque duis bibendum morbi non quam nec dui luctus rutrum nulla tellus in sagittis dui,2017-11-23 20:39:38,8
234,234,37,id pretium iaculis diam erat fermentum justo nec condimentum neque sapien placerat ante nulla justo aliquam quis turpis eget elit,2017-11-18 00:50:09,6
235,235,28,est quam pharetra magna ac consequat metus sapien ut nunc vestibulum ante ipsum,2017-02-14 22:45:21,6
236,236,72,in faucibus orci luctus et ultrices posuere cubilia curae donec pharetra magna vestibulum aliquet ultrices,2018-01-16 21:09:47,6
237,237,51,consectetuer eget rutrum at lorem integer tincidunt ante vel ipsum praesent blandit lacinia erat vestibulum sed magna at nunc,2017-06-01 19:32:30,2
238,238,33,posuere cubilia curae mauris viverra diam vitae quam suspendisse potenti nullam porttitor lacus,2017-05-15 19:29:00,7
239,239,55,urna ut tellus nulla ut erat id mauris vulputate elementum,2017-09-06 21:52:49,5
240,240,14,neque aenean auctor gravida sem praesent id massa id nisl venenatis lacinia aenean,2017-04-03 19:04:30,9
241,241,65,turpis elementum ligula vehicula consequat morbi a ipsum integer a nibh in quis,2017-05-08 00:48:53,8
242,242,85,proin eu mi nulla ac enim in tempor turpis nec euismod scelerisque quam turpis adipiscing lorem,2017-03-23 20:24:12,7
243,243,92,turpis a pede posuere nonummy integer non velit donec diam neque vestibulum eget vulputate,2017-07-22 21:34:16,9
244,244,1,posuere metus vitae ipsum aliquam non mauris morbi non lectus aliquam sit amet diam in magna,2017-05-30 06:00:52,1
245,245,85,non mauris morbi non lectus aliquam sit amet diam in magna bibendum imperdiet nullam,2017-12-06 09:47:14,2
246,246,63,in eleifend quam a odio in hac habitasse platea dictumst maecenas,2017-07-07 09:27:10,2
247,247,13,orci eget orci vehicula condimentum curabitur in libero ut massa volutpat convallis morbi odio odio elementum eu interdum eu,2017-09-11 20:19:10,5
248,248,52,suspendisse ornare consequat lectus in est risus auctor sed tristique in tempus sit amet sem fusce consequat nulla nisl nunc,2017-07-25 03:23:41,5
249,249,57,orci eget orci vehicula condimentum curabitur in libero ut massa volutpat convallis morbi odio odio elementum,2017-03-17 17:54:04,7
250,250,42,pede libero quis orci nullam molestie nibh in lectus pellentesque at nulla suspendisse potenti cras,2017-07-10 21:03:41,4
251,251,97,interdum mauris non ligula pellentesque ultrices phasellus id sapien in sapien iaculis congue vivamus metus arcu adipiscing molestie,2017-04-28 21:05:33,4
252,252,78,habitasse platea dictumst etiam faucibus cursus urna ut tellus nulla ut erat id mauris vulputate elementum nullam varius nulla facilisi,2017-12-04 10:52:27,4
253,253,87,maecenas pulvinar lobortis est phasellus sit amet erat nulla tempus vivamus in felis eu sapien,2017-10-19 14:59:31,1
254,254,18,elementum in hac habitasse platea dictumst morbi vestibulum velit id,2017-08-19 08:27:16,9
255,255,61,ac est lacinia nisi venenatis tristique fusce congue diam id ornare imperdiet,2017-11-08 04:07:36,5
256,256,49,sollicitudin ut suscipit a feugiat et eros vestibulum ac est lacinia nisi venenatis,2017-03-03 03:26:14,9
257,257,11,in lectus pellentesque at nulla suspendisse potenti cras in purus,2017-09-25 05:42:20,7
258,258,75,eu magna vulputate luctus cum sociis natoque penatibus et magnis dis parturient montes nascetur,2017-10-03 14:54:28,1
259,259,81,eu magna vulputate luctus cum sociis natoque penatibus et magnis dis parturient montes,2017-02-21 12:24:27,1
260,260,60,luctus nec molestie sed justo pellentesque viverra pede ac diam,2017-12-28 18:34:18,7
261,261,84,tincidunt eget tempus vel pede morbi porttitor lorem id ligula suspendisse ornare consequat lectus in est risus auctor sed tristique,2017-08-07 17:48:02,4
262,262,65,in ante vestibulum ante ipsum primis in faucibus orci luctus et ultrices posuere cubilia curae duis,2017-08-05 20:43:13,2
263,263,84,quis tortor id nulla ultrices aliquet maecenas leo odio condimentum id luctus nec molestie,2017-05-14 18:19:20,9
264,264,35,vel augue vestibulum ante ipsum primis in faucibus orci luctus et ultrices posuere cubilia curae,2017-11-03 12:15:13,7
265,265,4,volutpat dui maecenas tristique est et tempus semper est quam,2017-07-31 06:57:49,8
266,266,45,nullam orci pede venenatis non sodales sed tincidunt eu felis fusce posuere,2017-07-18 01:46:30,2
267,267,11,in faucibus orci luctus et ultrices posuere cubilia curae donec pharetra magna vestibulum aliquet ultrices,2017-11-01 22:50:24,3
268,268,52,ipsum ac tellus semper interdum mauris ullamcorper purus sit amet nulla quisque,2017-11-12 03:13:49,5
269,269,16,lacus purus aliquet at feugiat non pretium quis lectus suspendisse potenti in eleifend quam a odio in hac,2017-10-22 06:39:35,8
270,270,82,quam sollicitudin vitae consectetuer eget rutrum at lorem integer tincidunt ante vel ipsum praesent blandit lacinia erat,2017-04-16 19:33:51,2
271,271,30,sollicitudin vitae consectetuer eget rutrum at lorem integer tincidunt ante vel ipsum praesent blandit lacinia erat vestibulum sed,2018-01-20 06:22:05,9
272,272,83,felis sed interdum venenatis turpis enim blandit mi in porttitor pede justo eu massa donec dapibus,2017-03-13 22:55:48,8
273,273,43,non mattis pulvinar nulla pede ullamcorper augue a suscipit nulla elit ac nulla sed vel enim sit,2017-04-13 04:37:36,6
274,274,37,libero quis orci nullam molestie nibh in lectus pellentesque at nulla suspendisse potenti cras in purus eu magna vulputate,2017-08-26 16:09:10,6
275,275,55,tempor convallis nulla neque libero convallis eget eleifend luctus ultricies eu nibh quisque id,2017-12-21 17:27:56,1
276,276,25,nam ultrices libero non mattis pulvinar nulla pede ullamcorper augue a suscipit nulla elit ac nulla sed vel,2017-06-14 21:09:47,4
277,277,67,molestie nibh in lectus pellentesque at nulla suspendisse potenti cras in purus eu magna vulputate luctus,2017-09-05 05:06:22,1
278,278,65,nisl nunc rhoncus dui vel sem sed sagittis nam congue risus semper porta volutpat quam pede,2017-07-15 06:32:32,9
279,279,39,metus arcu adipiscing molestie hendrerit at vulputate vitae nisl aenean lectus pellentesque eget,2017-08-22 22:49:29,7
280,280,74,lectus vestibulum quam sapien varius ut blandit non interdum in,2017-06-11 21:57:17,7
281,281,53,aenean sit amet justo morbi ut odio cras mi pede malesuada in imperdiet et,2017-08-05 22:11:04,9
282,282,70,ultrices posuere cubilia curae mauris viverra diam vitae quam suspendisse potenti nullam porttitor lacus at turpis,2017-10-06 16:07:29,6
283,283,64,ipsum primis in faucibus orci luctus et ultrices posuere cubilia curae mauris viverra diam vitae quam suspendisse potenti nullam porttitor,2017-12-04 11:11:30,9
284,284,54,viverra diam vitae quam suspendisse potenti nullam porttitor lacus at turpis donec posuere metus vitae ipsum aliquam non,2017-09-25 16:57:17,5
285,285,30,lacinia sapien quis libero nullam sit amet turpis elementum ligula vehicula consequat morbi a ipsum integer a,2017-04-19 04:30:22,9
286,286,2,sapien sapien non mi integer ac neque duis bibendum morbi non,2017-05-13 23:58:56,2
287,287,35,justo in blandit ultrices enim lorem ipsum dolor sit amet consectetuer adipiscing elit proin interdum mauris non ligula pellentesque ultrices,2017-04-12 22:03:22,2
288,288,32,sollicitudin ut suscipit a feugiat et eros vestibulum ac est lacinia nisi venenatis tristique fusce congue diam id ornare imperdiet,2017-04-01 20:58:03,9
289,289,38,sapien varius ut blandit non interdum in ante vestibulum ante ipsum primis in faucibus orci luctus et ultrices,2017-11-02 08:35:06,6
290,290,63,aliquam convallis nunc proin at turpis a pede posuere nonummy integer non velit donec diam neque vestibulum,2017-12-31 09:31:46,2
291,291,1,gravida sem praesent id massa id nisl venenatis lacinia aenean sit amet justo morbi ut odio cras mi pede,2017-04-22 22:39:34,5
292,292,2,aliquet massa id lobortis convallis tortor risus dapibus augue vel accumsan tellus nisi,2017-11-17 05:30:42,7
293,293,1,faucibus orci luctus et ultrices posuere cubilia curae mauris viverra,2017-05-01 08:57:54,8
294,294,45,vulputate luctus cum sociis natoque penatibus et magnis dis parturient montes nascetur ridiculus mus vivamus,2017-05-31 13:56:43,4
295,295,99,nulla suscipit ligula in lacus curabitur at ipsum ac tellus semper interdum mauris ullamcorper,2018-01-15 17:18:29,6
296,296,29,quam pede lobortis ligula sit amet eleifend pede libero quis,2017-09-15 18:53:23,1
297,297,23,nec euismod scelerisque quam turpis adipiscing lorem vitae mattis nibh ligula nec sem duis aliquam convallis nunc proin at,2017-07-10 06:07:31,2
298,298,18,morbi non quam nec dui luctus rutrum nulla tellus in sagittis dui vel nisl duis,2017-05-04 22:20:59,3
299,299,13,nunc donec quis orci eget orci vehicula condimentum curabitur in libero ut massa volutpat,2017-06-12 12:03:13,2
300,300,96,orci nullam molestie nibh in lectus pellentesque at nulla suspendisse potenti cras in purus eu magna,2017-02-25 20:02:47,1
301,301,80,congue risus semper porta volutpat quam pede lobortis ligula sit amet eleifend pede libero quis orci nullam molestie,2017-05-31 21:25:47,8
302,302,29,sed sagittis nam congue risus semper porta volutpat quam pede lobortis ligula sit amet eleifend pede libero quis,2017-11-25 10:27:09,3
303,303,29,iaculis justo in hac habitasse platea dictumst etiam faucibus cursus urna ut,2017-11-07 22:16:07,8
304,304,57,donec ut dolor morbi vel lectus in quam fringilla rhoncus mauris enim leo rhoncus sed vestibulum sit amet cursus,2017-08-02 08:36:56,5
305,305,20,ac leo pellentesque ultrices mattis odio donec vitae nisi nam ultrices libero non mattis pulvinar,2017-04-07 11:17:09,8
306,306,2,mauris ullamcorper purus sit amet nulla quisque arcu libero rutrum ac lobortis vel dapibus,2017-06-08 06:49:48,8
307,307,46,massa donec dapibus duis at velit eu est congue elementum in,2017-02-10 01:02:31,4
308,308,59,sed vel enim sit amet nunc viverra dapibus nulla suscipit ligula in lacus curabitur at ipsum ac tellus,2017-10-04 06:30:07,9
309,309,74,neque libero convallis eget eleifend luctus ultricies eu nibh quisque id justo,2017-10-13 16:44:06,7
310,310,79,velit nec nisi vulputate nonummy maecenas tincidunt lacus at velit,2017-05-17 23:21:15,8
311,311,65,sapien dignissim vestibulum vestibulum ante ipsum primis in faucibus orci luctus,2017-05-12 18:09:33,2
312,312,20,venenatis turpis enim blandit mi in porttitor pede justo eu massa donec dapibus duis at velit eu est congue,2017-12-01 15:36:29,5
313,313,3,ut rhoncus aliquet pulvinar sed nisl nunc rhoncus dui vel sem sed sagittis,2017-10-16 04:49:17,6
314,314,98,orci luctus et ultrices posuere cubilia curae mauris viverra diam vitae quam suspendisse potenti nullam porttitor lacus at,2017-08-09 06:52:07,8
315,315,73,montes nascetur ridiculus mus etiam vel augue vestibulum rutrum rutrum neque aenean auctor gravida sem praesent id massa id,2017-07-22 03:58:51,5
316,316,76,non mattis pulvinar nulla pede ullamcorper augue a suscipit nulla elit ac,2017-06-29 02:47:31,4
317,317,73,justo sit amet sapien dignissim vestibulum vestibulum ante ipsum primis in faucibus orci luctus et ultrices posuere cubilia curae,2017-04-09 13:20:14,5
318,318,59,placerat praesent blandit nam nulla integer pede justo lacinia eget tincidunt eget tempus vel pede morbi porttitor lorem id ligula,2017-04-03 07:06:37,3
319,319,22,fringilla rhoncus mauris enim leo rhoncus sed vestibulum sit amet cursus id turpis integer aliquet massa id lobortis convallis tortor,2017-12-03 17:40:25,7
320,320,8,in eleifend quam a odio in hac habitasse platea dictumst maecenas ut massa quis augue luctus tincidunt,2018-01-29 20:19:56,5
321,321,8,semper sapien a libero nam dui proin leo odio porttitor id consequat in consequat,2017-05-01 12:15:36,8
322,322,27,lectus pellentesque at nulla suspendisse potenti cras in purus eu magna vulputate luctus cum sociis natoque penatibus et,2017-10-11 01:55:32,5
323,323,2,augue aliquam erat volutpat in congue etiam justo etiam pretium iaculis justo in hac habitasse platea dictumst,2017-12-04 08:25:08,1
324,324,8,augue vestibulum rutrum rutrum neque aenean auctor gravida sem praesent id massa id nisl venenatis lacinia aenean sit,2017-03-31 10:29:14,5
325,325,5,erat curabitur gravida nisi at nibh in hac habitasse platea dictumst aliquam augue quam sollicitudin vitae consectetuer eget rutrum,2017-05-16 15:09:31,5
326,326,2,rutrum nulla tellus in sagittis dui vel nisl duis ac,2018-01-06 13:18:26,2
327,327,15,vulputate luctus cum sociis natoque penatibus et magnis dis parturient montes nascetur ridiculus mus vivamus vestibulum sagittis sapien cum sociis,2017-03-04 19:41:02,7
328,328,19,tristique fusce congue diam id ornare imperdiet sapien urna pretium nisl ut volutpat sapien arcu sed augue aliquam,2017-09-11 15:46:07,9
329,329,17,hac habitasse platea dictumst etiam faucibus cursus urna ut tellus nulla ut erat id mauris vulputate elementum nullam varius,2017-04-25 11:55:33,2
330,330,17,dictumst aliquam augue quam sollicitudin vitae consectetuer eget rutrum at lorem integer,2017-08-02 19:00:51,3
331,331,62,et eros vestibulum ac est lacinia nisi venenatis tristique fusce congue diam id ornare imperdiet sapien urna pretium nisl,2017-03-14 11:44:58,2
332,332,3,semper porta volutpat quam pede lobortis ligula sit amet eleifend pede libero quis orci nullam molestie nibh in lectus pellentesque,2017-02-28 18:40:41,4
333,333,99,curabitur convallis duis consequat dui nec nisi volutpat eleifend donec ut dolor morbi vel lectus in quam fringilla rhoncus,2017-05-20 18:13:09,9
334,334,45,odio elementum eu interdum eu tincidunt in leo maecenas pulvinar lobortis est phasellus sit,2017-05-09 12:00:49,7
335,335,51,turpis eget elit sodales scelerisque mauris sit amet eros suspendisse accumsan tortor quis turpis sed ante vivamus tortor,2017-05-15 07:52:34,6
336,336,60,ut dolor morbi vel lectus in quam fringilla rhoncus mauris enim,2017-03-13 13:38:22,2
337,337,82,est et tempus semper est quam pharetra magna ac consequat,2018-01-04 16:30:15,3
338,338,14,nibh in hac habitasse platea dictumst aliquam augue quam sollicitudin vitae consectetuer eget rutrum at lorem integer tincidunt,2017-11-03 20:55:43,9
339,339,91,tempus vivamus in felis eu sapien cursus vestibulum proin eu mi nulla ac enim in tempor turpis,2018-01-18 05:52:40,3
340,340,77,sit amet sem fusce consequat nulla nisl nunc nisl duis bibendum felis sed,2017-12-14 16:57:47,2
341,341,49,ipsum ac tellus semper interdum mauris ullamcorper purus sit amet nulla quisque arcu libero rutrum ac lobortis vel,2017-06-21 21:47:05,5
342,342,7,vestibulum eget vulputate ut ultrices vel augue vestibulum ante ipsum primis,2017-05-09 19:37:53,7
343,343,89,sollicitudin ut suscipit a feugiat et eros vestibulum ac est lacinia nisi venenatis tristique,2017-05-11 21:16:23,5
344,344,95,leo odio porttitor id consequat in consequat ut nulla sed accumsan felis,2017-05-06 13:15:58,5
345,345,26,mauris lacinia sapien quis libero nullam sit amet turpis elementum ligula vehicula consequat morbi a ipsum integer,2017-05-11 10:09:04,9
346,346,18,nunc vestibulum ante ipsum primis in faucibus orci luctus et ultrices posuere cubilia curae mauris viverra diam vitae quam suspendisse,2017-04-07 00:47:59,2
347,347,88,enim lorem ipsum dolor sit amet consectetuer adipiscing elit proin interdum mauris non ligula pellentesque ultrices,2017-04-11 13:06:45,7
348,348,65,ultrices vel augue vestibulum ante ipsum primis in faucibus orci luctus et ultrices,2017-08-07 00:25:31,7
349,349,42,maecenas rhoncus aliquam lacus morbi quis tortor id nulla ultrices,2017-04-30 20:14:14,4
350,350,92,tincidunt eu felis fusce posuere felis sed lacus morbi sem mauris laoreet ut rhoncus,2017-12-15 14:00:39,2
351,351,74,ipsum dolor sit amet consectetuer adipiscing elit proin risus praesent lectus vestibulum quam sapien,2017-03-17 17:39:38,8
352,352,67,malesuada in imperdiet et commodo vulputate justo in blandit ultrices enim lorem ipsum dolor sit amet consectetuer adipiscing elit,2017-04-03 18:10:57,2
353,353,61,tristique est et tempus semper est quam pharetra magna ac consequat metus sapien ut,2017-03-14 20:49:16,9
354,354,72,praesent blandit lacinia erat vestibulum sed magna at nunc commodo placerat praesent blandit nam nulla integer,2018-02-04 11:06:04,7
355,355,52,in magna bibendum imperdiet nullam orci pede venenatis non sodales sed tincidunt eu felis fusce posuere,2017-06-27 17:37:32,5
356,356,78,ullamcorper augue a suscipit nulla elit ac nulla sed vel enim,2017-11-10 10:59:23,7
357,357,25,in faucibus orci luctus et ultrices posuere cubilia curae donec pharetra magna vestibulum aliquet ultrices erat tortor,2018-02-07 12:38:49,2
358,358,31,montes nascetur ridiculus mus vivamus vestibulum sagittis sapien cum sociis natoque penatibus et magnis dis parturient montes nascetur ridiculus mus,2017-07-25 22:19:58,3
359,359,84,eu mi nulla ac enim in tempor turpis nec euismod scelerisque quam turpis adipiscing lorem vitae mattis nibh,2017-03-01 20:30:16,5
360,360,47,aliquam augue quam sollicitudin vitae consectetuer eget rutrum at lorem integer tincidunt ante vel ipsum,2017-05-26 00:40:55,3
361,361,49,eget tincidunt eget tempus vel pede morbi porttitor lorem id ligula suspendisse ornare consequat lectus in est,2017-08-10 23:28:32,1
362,362,50,nec condimentum neque sapien placerat ante nulla justo aliquam quis turpis eget elit sodales scelerisque mauris sit amet,2017-10-03 05:16:57,9
363,363,39,sit amet eros suspendisse accumsan tortor quis turpis sed ante vivamus tortor duis,2017-12-11 16:01:11,1
364,364,15,odio justo sollicitudin ut suscipit a feugiat et eros vestibulum ac,2017-12-28 03:21:09,8
365,365,48,accumsan tortor quis turpis sed ante vivamus tortor duis mattis egestas metus aenean fermentum donec ut mauris eget,2017-04-19 17:43:10,7
366,366,82,morbi non lectus aliquam sit amet diam in magna bibendum,2018-01-25 08:34:16,6
367,367,25,nisi nam ultrices libero non mattis pulvinar nulla pede ullamcorper augue a suscipit nulla elit ac nulla sed vel,2017-07-30 11:10:13,2
368,368,57,eros viverra eget congue eget semper rutrum nulla nunc purus phasellus in felis,2017-05-19 17:14:35,2
369,369,99,etiam faucibus cursus urna ut tellus nulla ut erat id mauris vulputate,2017-05-19 20:56:51,5
370,370,58,id massa id nisl venenatis lacinia aenean sit amet justo morbi ut odio cras,2017-04-26 14:03:05,2
371,371,22,suspendisse potenti nullam porttitor lacus at turpis donec posuere metus vitae ipsum aliquam,2017-07-08 02:04:04,3
372,372,1,odio odio elementum eu interdum eu tincidunt in leo maecenas pulvinar lobortis est phasellus,2017-09-21 11:14:29,5
373,373,96,leo maecenas pulvinar lobortis est phasellus sit amet erat nulla tempus vivamus,2017-05-19 11:51:11,2
374,374,63,fusce consequat nulla nisl nunc nisl duis bibendum felis sed interdum venenatis,2017-06-26 23:01:40,4
375,375,97,vel nulla eget eros elementum pellentesque quisque porta volutpat erat quisque erat,2017-06-12 12:48:08,4
376,376,57,porttitor id consequat in consequat ut nulla sed accumsan felis ut at,2017-11-25 11:10:50,8
377,377,84,in quam fringilla rhoncus mauris enim leo rhoncus sed vestibulum sit amet cursus id turpis integer,2017-05-27 09:48:53,9
378,378,3,justo etiam pretium iaculis justo in hac habitasse platea dictumst etiam faucibus cursus urna ut tellus,2017-04-26 11:54:29,8
379,379,13,sapien non mi integer ac neque duis bibendum morbi non quam,2017-05-18 23:38:35,1
380,380,2,ut at dolor quis odio consequat varius integer ac leo pellentesque ultrices mattis odio donec,2017-09-27 11:31:28,2
381,381,12,mauris laoreet ut rhoncus aliquet pulvinar sed nisl nunc rhoncus dui vel sem sed sagittis nam congue risus semper porta,2017-07-11 00:38:11,3
382,382,10,dolor morbi vel lectus in quam fringilla rhoncus mauris enim leo rhoncus,2017-11-13 10:44:19,6
383,383,96,pede ullamcorper augue a suscipit nulla elit ac nulla sed vel enim sit amet nunc viverra dapibus,2017-06-24 03:44:14,4
384,384,9,sapien a libero nam dui proin leo odio porttitor id consequat in consequat ut,2017-08-20 11:28:09,6
385,385,58,consequat varius integer ac leo pellentesque ultrices mattis odio donec vitae nisi nam ultrices,2017-04-16 09:00:42,1
386,386,48,venenatis lacinia aenean sit amet justo morbi ut odio cras mi pede malesuada in imperdiet et commodo vulputate justo in,2017-11-10 06:04:05,5
387,387,56,erat quisque erat eros viverra eget congue eget semper rutrum nulla nunc purus,2017-11-30 21:25:19,1
388,388,81,vulputate vitae nisl aenean lectus pellentesque eget nunc donec quis orci eget orci vehicula condimentum curabitur in libero,2017-07-28 15:46:39,3
389,389,58,vestibulum ante ipsum primis in faucibus orci luctus et ultrices posuere cubilia curae donec pharetra,2017-11-28 16:58:06,6
390,390,74,vestibulum ante ipsum primis in faucibus orci luctus et ultrices posuere cubilia curae nulla dapibus dolor,2017-03-14 08:00:20,3
391,391,71,sapien placerat ante nulla justo aliquam quis turpis eget elit sodales scelerisque mauris sit amet eros suspendisse accumsan tortor,2017-09-17 16:42:51,4
392,392,70,odio cras mi pede malesuada in imperdiet et commodo vulputate justo in,2017-10-16 03:24:26,4
393,393,74,nisl venenatis lacinia aenean sit amet justo morbi ut odio cras mi pede malesuada in imperdiet,2017-12-18 10:14:12,8
394,394,61,augue aliquam erat volutpat in congue etiam justo etiam pretium iaculis justo,2017-12-28 06:26:23,2
395,395,13,urna pretium nisl ut volutpat sapien arcu sed augue aliquam erat volutpat in congue etiam justo etiam pretium iaculis justo,2017-06-18 08:37:53,6
396,396,16,ipsum dolor sit amet consectetuer adipiscing elit proin interdum mauris non,2017-09-28 17:08:53,6
397,397,55,non velit nec nisi vulputate nonummy maecenas tincidunt lacus at velit vivamus vel,2017-09-01 18:53:20,9
398,398,61,sapien sapien non mi integer ac neque duis bibendum morbi non quam nec dui luctus rutrum nulla tellus,2017-06-28 22:54:55,6
399,399,12,vulputate elementum nullam varius nulla facilisi cras non velit nec nisi vulputate nonummy maecenas tincidunt lacus at velit,2018-02-01 11:41:10,1
400,400,22,curae donec pharetra magna vestibulum aliquet ultrices erat tortor sollicitudin mi sit amet lobortis sapien sapien non mi integer,2017-06-16 18:22:27,6
401,401,82,non mauris morbi non lectus aliquam sit amet diam in,2017-05-20 17:06:55,2
402,402,85,sit amet justo morbi ut odio cras mi pede malesuada in imperdiet,2017-11-07 07:02:36,6
403,403,70,consectetuer adipiscing elit proin risus praesent lectus vestibulum quam sapien varius ut blandit non interdum in,2017-05-26 05:59:29,3
