1,1,84,blandit ultrices enim lorem ipsum dolor sit amet consectetuer adipiscing elit proin,2017-05-03 21:36:50,6
2,2,6,vestibulum ante ipsum primis in faucibus orci luctus et ultrices posuere cubilia curae nulla dapibus dolor vel est donec odio,2017-08-06 23:34:15,1
3,3,49,amet justo morbi ut odio cras mi pede malesuada in imperdiet et commodo vulputate justo in blandit ultrices,2018-01-23 01:17:38,6
4,4,87,praesent blandit nam nulla integer pede justo lacinia eget tincidunt eget tempus vel pede morbi porttitor lorem id ligula suspendisse,2018-02-07 09:33:54,1
5,5,71,non velit donec diam neque vestibulum eget vulputate ut ultrices vel augue vestibulum ante ipsum primis in faucibus,2017-02-18 20:35:33,9
6,6,99,odio porttitor id consequat in consequat ut nulla sed accumsan felis ut at dolor,2017-09-29 09:38:09,2
7,7,22,mi in porttitor pede justo eu massa donec dapibus duis at velit eu est congue elementum in hac habitasse,2017-03-27 17:28:14,5
8,8,53,risus semper porta volutpat quam pede lobortis ligula sit amet eleifend pede libero quis orci,2017-10-04 21:25:14,7
9,9,18,eleifend luctus ultricies eu nibh quisque id justo sit amet sapien,2017-02-23 13:10:38,7
10,10,15,non mattis pulvinar nulla pede ullamcorper augue a suscipit nulla elit ac,2017-09-28 21:50:56,1
11,11,49,adipiscing elit proin risus praesent lectus vestibulum quam sapien varius ut blandit non interdum,2017-10-23 00:27:15,1
12,12,21,aliquet pulvinar sed nisl nunc rhoncus dui vel sem sed sagittis nam congue risus semper porta volutpat quam,2017-03-18 16:55:33,7
13,13,73,turpis eget elit sodales scelerisque mauris sit amet eros suspendisse accumsan tortor quis turpis sed ante vivamus tortor duis mattis,2017-05-16 13:39:10,8
14,14,90,fringilla rhoncus mauris enim leo rhoncus sed vestibulum sit amet cursus id,2017-02-28 00:36:41,7
15,15,4,massa id nisl venenatis lacinia aenean sit amet justo morbi ut odio cras mi pede,2017-02-28 02:21:39,2
16,16,54,nulla neque libero convallis eget eleifend luctus ultricies eu nibh quisque id justo sit amet sapien,2017-11-17 04:30:31,8
17,17,47,ipsum integer a nibh in quis justo maecenas rhoncus aliquam lacus,2017-03-25 21:34:55,3
18,18,55,sit amet erat nulla tempus vivamus in felis eu sapien cursus vestibulum proin eu,2017-09-03 18:52:11,8
19,19,35,vestibulum sed magna at nunc commodo placerat praesent blandit nam nulla integer pede justo lacinia eget,2017-10-30 14:27:21,4
20,20,24,non quam nec dui luctus rutrum nulla tellus in sagittis dui,2017-02-13 23:16:07,8
21,21,52,condimentum neque sapien placerat ante nulla justo aliquam quis turpis eget,2017-04-06 21:32:38,7
22,22,24,sed interdum venenatis turpis enim blandit mi in porttitor pede,2017-09-17 18:15:04,5
23,23,66,in hac habitasse platea dictumst aliquam augue quam sollicitudin vitae consectetuer eget rutrum at,2018-02-07 00:52:40,5
24,24,41,a suscipit nulla elit ac nulla sed vel enim sit amet nunc,2017-05-06 06:55:20,6
25,25,57,volutpat sapien arcu sed augue aliquam erat volutpat in congue,2017-03-09 19:29:39,1
26,26,46,libero ut massa volutpat convallis morbi odio odio elementum eu interdum eu,2017-10-30 00:03:41,1
27,27,58,dui vel sem sed sagittis nam congue risus semper porta,2017-06-04 20:31:08,9
28,28,49,lectus pellentesque eget nunc donec quis orci eget orci vehicula condimentum curabitur in libero ut massa volutpat convallis morbi,2018-02-05 21:29:52,5
29,29,4,ultrices posuere cubilia curae nulla dapibus dolor vel est donec odio justo,2017-11-10 18:10:57,9
30,30,41,sapien cum sociis natoque penatibus et magnis dis parturient montes nascetur ridiculus,2018-01-08 02:45:47,8
31,31,18,tortor sollicitudin mi sit amet lobortis sapien sapien non mi integer ac neque duis bibendum morbi non quam nec dui,2017-11-17 23:32:43,8
32,32,53,ante vivamus tortor duis mattis egestas metus aenean fermentum donec ut mauris eget massa tempor,2017-10-01 17:38:22,7
33,33,84,lectus pellentesque at nulla suspendisse potenti cras in purus eu,2017-10-26 14:55:40,7
34,34,76,sapien placerat ante nulla justo aliquam quis turpis eget elit,2017-10-14 23:49:52,3
35,35,37,vel augue vestibulum rutrum rutrum neque aenean auctor gravida sem praesent id massa,2017-11-11 13:36:07,5
36,36,41,dapibus augue vel accumsan tellus nisi eu orci mauris lacinia sapien quis,2017-03-01 19:33:07,8
37,37,42,orci luctus et ultrices posuere cubilia curae mauris viverra diam vitae,2017-07-25 23:39:14,7
38,38,16,consequat in consequat ut nulla sed accumsan felis ut at dolor quis odio consequat varius integer ac,2017-10-11 10:36:30,2
39,39,32,est lacinia nisi venenatis tristique fusce congue diam id ornare imperdiet,2017-08-10 12:17:05,2
40,40,87,ultrices erat tortor sollicitudin mi sit amet lobortis sapien sapien non mi integer ac neque duis bibendum morbi non,2018-01-05 07:14:04,8
41,41,99,tempus semper est quam pharetra magna ac consequat metus sapien ut nunc vestibulum ante ipsum primis in faucibus orci,2017-09-12 12:22:57,3
42,42,70,ut mauris eget massa tempor convallis nulla neque libero convallis eget eleifend luctus ultricies,2017-05-04 02:11:02,4
43,43,98,justo maecenas rhoncus aliquam lacus morbi quis tortor id nulla ultrices aliquet maecenas leo,2017-12-28 01:09:33,2
44,44,69,montes nascetur ridiculus mus etiam vel augue vestibulum rutrum rutrum neque aenean auctor gravida sem praesent,2017-04-12 14:47:04,4
45,45,32,congue etiam justo etiam pretium iaculis justo in hac habitasse platea dictumst etiam faucibus cursus urna ut,2017-09-27 20:26:14,8
46,46,21,ante vestibulum ante ipsum primis in faucibus orci luctus et ultrices posuere cubilia curae duis,2017-06-02 07:54:40,9
47,47,99,nisi venenatis tristique fusce congue diam id ornare imperdiet sapien urna,2017-07-14 08:49:38,5
48,48,17,eget semper rutrum nulla nunc purus phasellus in felis donec semper sapien a libero nam dui proin leo,2017-09-12 00:58:19,7
49,49,35,congue etiam justo etiam pretium iaculis justo in hac habitasse platea dictumst etiam faucibus cursus,2017-09-06 08:15:15,3
50,50,59,eleifend quam a odio in hac habitasse platea dictumst maecenas ut massa quis augue luctus tincidunt nulla mollis molestie lorem,2017-10-04 04:39:38,6
51,51,91,vivamus metus arcu adipiscing molestie hendrerit at vulputate vitae nisl,2018-01-20 10:17:15,9
52,52,87,cursus id turpis integer aliquet massa id lobortis convallis tortor risus dapibus augue,2017-02-22 18:58:29,3
53,53,82,platea dictumst aliquam augue quam sollicitudin vitae consectetuer eget rutrum,2017-08-20 22:42:19,9
54,54,67,accumsan tellus nisi eu orci mauris lacinia sapien quis libero nullam sit amet turpis elementum ligula vehicula consequat,2017-05-10 10:42:32,1
55,55,60,at vulputate vitae nisl aenean lectus pellentesque eget nunc donec quis orci eget orci vehicula condimentum curabitur,2017-04-05 12:01:02,5
56,56,96,vestibulum velit id pretium iaculis diam erat fermentum justo nec condimentum neque sapien placerat ante nulla justo aliquam quis,2017-11-12 21:34:23,5
57,57,2,ultrices posuere cubilia curae duis faucibus accumsan odio curabitur convallis,2017-08-12 12:52:02,5
58,58,70,turpis nec euismod scelerisque quam turpis adipiscing lorem vitae mattis nibh,2017-02-17 02:13:00,7
59,59,80,urna pretium nisl ut volutpat sapien arcu sed augue aliquam erat volutpat in congue etiam justo etiam pretium iaculis,2017-05-15 04:36:30,2
60,60,27,magna bibendum imperdiet nullam orci pede venenatis non sodales sed tincidunt eu felis fusce posuere felis sed lacus,2018-02-03 04:56:39,2
61,61,7,eget eros elementum pellentesque quisque porta volutpat erat quisque erat eros viverra eget congue eget semper,2017-10-12 04:52:31,4
62,62,26,rhoncus aliquet pulvinar sed nisl nunc rhoncus dui vel sem sed sagittis,2017-03-16 11:16:23,6
63,63,88,dictumst etiam faucibus cursus urna ut tellus nulla ut erat,2017-07-21 15:20:55,6
64,64,83,ac neque duis bibendum morbi non quam nec dui luctus rutrum nulla tellus in sagittis dui vel,2018-02-02 13:02:11,5
65,65,95,eget elit sodales scelerisque mauris sit amet eros suspendisse accumsan tortor quis turpis sed ante vivamus tortor,2017-04-27 23:42:41,9
66,66,40,augue vestibulum rutrum rutrum neque aenean auctor gravida sem praesent id massa id nisl venenatis lacinia,2017-04-07 19:18:30,1
67,67,95,nulla dapibus dolor vel est donec odio justo sollicitudin ut suscipit a feugiat et eros vestibulum ac est,2017-08-18 15:30:16,3
68,68,70,volutpat in congue etiam justo etiam pretium iaculis justo in hac,2017-10-26 12:48:59,3
69,69,4,nibh in lectus pellentesque at nulla suspendisse potenti cras in purus eu,2017-06-17 12:50:41,7
70,70,78,rhoncus dui vel sem sed sagittis nam congue risus semper porta volutpat quam pede lobortis ligula sit amet,2017-03-05 13:23:41,2
71,71,37,sem praesent id massa id nisl venenatis lacinia aenean sit,2017-12-28 08:22:33,4
72,72,22,volutpat dui maecenas tristique est et tempus semper est quam,2017-07-19 00:36:10,8
73,73,66,odio porttitor id consequat in consequat ut nulla sed accumsan felis ut at dolor quis odio consequat,2017-02-20 13:01:20,4
74,74,94,pharetra magna vestibulum aliquet ultrices erat tortor sollicitudin mi sit amet,2017-09-02 14:11:31,2
75,75,88,dolor sit amet consectetuer adipiscing elit proin risus praesent lectus vestibulum quam sapien varius ut blandit non interdum,2017-05-23 22:07:07,1
76,76,4,non mi integer ac neque duis bibendum morbi non quam nec,2017-09-10 18:08:31,7
77,77,35,nonummy integer non velit donec diam neque vestibulum eget vulputate ut ultrices vel augue,2017-11-21 19:48:58,4
78,78,90,bibendum imperdiet nullam orci pede venenatis non sodales sed tincidunt eu felis fusce posuere felis sed lacus morbi sem,2017-05-09 15:38:24,8
79,79,30,a nibh in quis justo maecenas rhoncus aliquam lacus morbi quis tortor id nulla,2017-09-20 05:49:49,5
80,80,67,consectetuer adipiscing elit proin interdum mauris non ligula pellentesque ultrices phasellus id sapien in sapien,2017-12-25 04:19:53,1
81,81,21,amet cursus id turpis integer aliquet massa id lobortis convallis,2017-12-23 21:34:07,6
82,82,85,donec ut dolor morbi vel lectus in quam fringilla rhoncus mauris enim leo rhoncus sed vestibulum sit,2017-06-24 06:38:40,6
83,83,4,amet justo morbi ut odio cras mi pede malesuada in imperdiet et commodo vulputate justo,2017-08-01 20:28:43,8
84,84,58,rhoncus aliquam lacus morbi quis tortor id nulla ultrices aliquet maecenas,2017-07-02 05:47:37,8
85,85,59,nullam varius nulla facilisi cras non velit nec nisi vulputate nonummy maecenas tincidunt lacus,2017-04-04 05:25:12,8
86,86,50,tortor sollicitudin mi sit amet lobortis sapien sapien non mi integer ac neque duis bibendum morbi non quam nec dui,2017-06-08 23:02:25,4
87,87,36,id justo sit amet sapien dignissim vestibulum vestibulum ante ipsum primis in faucibus orci luctus et ultrices posuere cubilia,2017-03-31 06:59:59,3
88,88,52,pulvinar sed nisl nunc rhoncus dui vel sem sed sagittis nam,2017-12-08 01:07:51,4
89,89,66,sapien iaculis congue vivamus metus arcu adipiscing molestie hendrerit at vulputate vitae nisl aenean lectus pellentesque eget,2017-06-25 11:58:51,7
90,90,79,quis justo maecenas rhoncus aliquam lacus morbi quis tortor id nulla ultrices aliquet maecenas leo odio condimentum id,2017-11-13 06:08:47,9
91,91,65,sem mauris laoreet ut rhoncus aliquet pulvinar sed nisl nunc rhoncus dui vel sem sed sagittis nam congue,2017-11-08 06:52:46,9
92,92,3,rutrum nulla nunc purus phasellus in felis donec semper sapien a libero nam dui proin leo odio,2017-03-30 17:07:31,3
93,93,15,viverra diam vitae quam suspendisse potenti nullam porttitor lacus at turpis donec posuere metus,2017-06-13 19:12:33,7
94,94,10,vestibulum ac est lacinia nisi venenatis tristique fusce congue diam id ornare imperdiet sapien urna,2017-08-21 16:34:12,7
95,95,7,cursus vestibulum proin eu mi nulla ac enim in tempor turpis nec euismod scelerisque quam turpis adipiscing lorem vitae,2017-10-07 08:51:07,2
96,96,57,lectus pellentesque at nulla suspendisse potenti cras in purus eu magna vulputate luctus cum sociis natoque penatibus et magnis dis,2018-01-13 03:41:55,5
97,97,67,in lectus pellentesque at nulla suspendisse potenti cras in purus eu,2017-02-19 16:59:05,7
98,98,38,at lorem integer tincidunt ante vel ipsum praesent blandit lacinia erat vestibulum,2017-03-10 13:50:27,3
99,99,68,primis in faucibus orci luctus et ultrices posuere cubilia curae donec pharetra,2017-08-05 19:37:29,2
100,100,50,mauris sit amet eros suspendisse accumsan tortor quis turpis sed ante vivamus tortor duis,2017-07-13 23:09:19,4
101,101,18,vestibulum ante ipsum primis in faucibus orci luctus et ultrices posuere,2017-09-10 02:29:10,5
102,102,11,rutrum neque aenean auctor gravida sem praesent id massa id nisl venenatis lacinia,2017-11-05 09:54:09,4
103,103,47,quam pharetra magna ac consequat metus sapien ut nunc vestibulum,2017-10-12 13:47:28,1
104,104,77,potenti in eleifend quam a odio in hac habitasse platea dictumst maecenas ut massa quis augue luctus tincidunt nulla,2017-06-27 15:29:17,4
105,105,51,integer ac neque duis bibendum morbi non quam nec dui,2017-05-08 06:09:41,7
106,106,30,praesent blandit nam nulla integer pede justo lacinia eget tincidunt eget tempus vel pede morbi porttitor,2017-03-31 15:29:46,7
107,107,20,leo odio condimentum id luctus nec molestie sed justo pellentesque viverra pede ac diam cras pellentesque volutpat dui maecenas tristique,2017-03-03 18:02:23,9
108,108,49,aenean sit amet justo morbi ut odio cras mi pede malesuada in imperdiet et commodo vulputate justo in blandit,2017-02-24 22:07:05,6
109,109,24,duis consequat dui nec nisi volutpat eleifend donec ut dolor morbi vel lectus,2017-03-24 10:37:42,4
110,110,27,duis faucibus accumsan odio curabitur convallis duis consequat dui nec nisi,2017-12-19 17:33:31,3
111,111,21,curae donec pharetra magna vestibulum aliquet ultrices erat tortor sollicitudin mi sit amet lobortis sapien sapien non mi integer,2017-12-16 18:12:50,7
112,112,22,curabitur in libero ut massa volutpat convallis morbi odio odio elementum,2017-12-31 23:19:40,5
113,113,66,magna ac consequat metus sapien ut nunc vestibulum ante ipsum primis in faucibus orci,2017-09-09 07:42:15,7
114,114,14,integer a nibh in quis justo maecenas rhoncus aliquam lacus morbi quis tortor id nulla ultrices,2017-08-08 03:13:25,9
115,115,16,congue risus semper porta volutpat quam pede lobortis ligula sit amet eleifend pede libero quis orci,2017-07-24 02:22:05,4
116,116,86,rutrum neque aenean auctor gravida sem praesent id massa id nisl venenatis lacinia aenean sit,2017-04-25 05:56:06,1
117,117,85,neque duis bibendum morbi non quam nec dui luctus rutrum nulla tellus in sagittis dui vel nisl,2017-08-04 18:20:23,7
118,118,50,aliquet at feugiat non pretium quis lectus suspendisse potenti in eleifend quam a,2017-10-11 03:37:18,8
119,119,11,in sapien iaculis congue vivamus metus arcu adipiscing molestie hendrerit at vulputate,2017-11-24 10:40:07,9
120,120,78,lobortis sapien sapien non mi integer ac neque duis bibendum morbi non quam nec,2017-12-29 06:08:30,6
121,121,84,ligula suspendisse ornare consequat lectus in est risus auctor sed tristique,2017-12-22 23:09:51,1
122,122,33,in hac habitasse platea dictumst maecenas ut massa quis augue luctus tincidunt nulla mollis molestie lorem,2017-11-14 09:09:29,4
123,123,83,non lectus aliquam sit amet diam in magna bibendum imperdiet nullam orci pede venenatis non sodales sed tincidunt eu,2017-03-15 06:28:40,4
124,124,38,tellus in sagittis dui vel nisl duis ac nibh fusce lacus purus aliquet at feugiat non pretium quis lectus,2017-10-17 20:40:03,6
125,125,26,consequat ut nulla sed accumsan felis ut at dolor quis,2017-07-07 01:12:38,6
126,126,7,primis in faucibus orci luctus et ultrices posuere cubilia curae donec pharetra magna,2017-04-01 12:45:10,3
127,127,96,potenti in eleifend quam a odio in hac habitasse platea dictumst maecenas ut massa quis augue luctus tincidunt nulla,2017-12-17 09:46:32,1
128,128,91,felis sed lacus morbi sem mauris laoreet ut rhoncus aliquet pulvinar sed nisl nunc rhoncus dui vel sem,2017-07-13 02:28:02,9
129,129,79,proin interdum mauris non ligula pellentesque ultrices phasellus id sapien in sapien iaculis congue vivamus metus arcu adipiscing molestie hendrerit,2017-12-04 12:29:47,7
130,130,19,in blandit ultrices enim lorem ipsum dolor sit amet consectetuer adipiscing elit,2018-01-17 19:41:45,3
131,131,8,tincidunt lacus at velit vivamus vel nulla eget eros elementum pellentesque quisque porta volutpat erat quisque erat,2017-10-02 20:45:36,3
132,132,29,nulla suscipit ligula in lacus curabitur at ipsum ac tellus semper interdum mauris ullamcorper purus sit amet,2017-09-10 02:53:03,5
133,133,27,lobortis est phasellus sit amet erat nulla tempus vivamus in felis eu sapien,2018-02-04 21:28:04,6
134,134,70,eu nibh quisque id justo sit amet sapien dignissim vestibulum vestibulum ante ipsum,2017-03-27 22:50:22,7
135,135,22,blandit nam nulla integer pede justo lacinia eget tincidunt eget tempus,2017-07-18 06:28:00,4
136,136,70,dui vel nisl duis ac nibh fusce lacus purus aliquet,2017-05-22 06:48:00,8
137,137,47,nisi venenatis tristique fusce congue diam id ornare imperdiet sapien urna pretium nisl ut volutpat,2017-10-15 08:35:50,1
138,138,60,ut erat curabitur gravida nisi at nibh in hac habitasse,2017-06-24 01:07:42,3
139,139,36,amet turpis elementum ligula vehicula consequat morbi a ipsum integer a nibh in quis justo maecenas rhoncus aliquam lacus,2017-02-18 05:03:51,2
140,140,23,ut erat id mauris vulputate elementum nullam varius nulla facilisi,2017-03-07 12:11:27,2
141,141,2,ultrices erat tortor sollicitudin mi sit amet lobortis sapien sapien non mi integer,2017-04-26 13:44:11,9
142,142,23,dolor sit amet consectetuer adipiscing elit proin risus praesent lectus vestibulum quam,2018-01-31 04:58:58,2
143,143,48,et ultrices posuere cubilia curae duis faucibus accumsan odio curabitur convallis duis consequat dui nec nisi volutpat eleifend donec ut,2017-08-12 16:03:55,8
144,144,19,mauris viverra diam vitae quam suspendisse potenti nullam porttitor lacus at turpis donec posuere metus vitae,2017-11-27 14:10:28,1
145,145,77,suspendisse potenti cras in purus eu magna vulputate luctus cum sociis natoque penatibus,2018-01-10 01:22:08,5
146,146,23,faucibus orci luctus et ultrices posuere cubilia curae mauris viverra diam vitae quam suspendisse potenti,2017-05-31 13:31:12,6
147,147,72,metus aenean fermentum donec ut mauris eget massa tempor convallis,2017-11-05 21:20:39,4
148,148,76,egestas metus aenean fermentum donec ut mauris eget massa tempor convallis nulla neque libero convallis eget eleifend luctus ultricies eu,2017-09-30 04:26:45,6
149,149,71,nullam porttitor lacus at turpis donec posuere metus vitae ipsum aliquam non mauris morbi non lectus aliquam sit amet diam,2017-02-14 00:19:40,9
150,150,100,in hac habitasse platea dictumst morbi vestibulum velit id pretium iaculis,2017-09-09 16:48:12,6
151,151,98,auctor gravida sem praesent id massa id nisl venenatis lacinia aenean sit amet justo morbi ut odio cras,2018-01-21 17:31:25,9
152,152,26,vivamus vestibulum sagittis sapien cum sociis natoque penatibus et magnis dis parturient montes nascetur ridiculus mus etiam,2017-07-25 08:59:50,9
153,153,33,vulputate luctus cum sociis natoque penatibus et magnis dis parturient montes nascetur ridiculus mus vivamus vestibulum,2017-03-20 18:04:24,5
154,154,20,parturient montes nascetur ridiculus mus etiam vel augue vestibulum rutrum rutrum,2017-06-12 00:13:40,5
155,155,78,eget rutrum at lorem integer tincidunt ante vel ipsum praesent blandit lacinia,2017-06-02 16:52:15,3
156,156,13,quis orci eget orci vehicula condimentum curabitur in libero ut massa volutpat convallis morbi odio odio,2017-10-28 18:27:35,9
157,157,8,donec semper sapien a libero nam dui proin leo odio porttitor id consequat in consequat ut nulla sed accumsan,2017-03-19 16:00:47,3
158,158,62,ut rhoncus aliquet pulvinar sed nisl nunc rhoncus dui vel sem,2018-01-26 16:17:28,3
159,159,80,elit proin interdum mauris non ligula pellentesque ultrices phasellus id sapien in sapien iaculis congue vivamus metus arcu adipiscing,2018-01-27 04:30:12,2
160,160,13,id sapien in sapien iaculis congue vivamus metus arcu adipiscing molestie hendrerit at vulputate vitae nisl aenean lectus pellentesque,2017-12-21 05:44:36,6
161,161,70,sapien ut nunc vestibulum ante ipsum primis in faucibus orci luctus et ultrices posuere cubilia curae mauris viverra,2017-09-15 07:32:39,3
162,162,66,potenti cras in purus eu magna vulputate luctus cum sociis natoque penatibus et magnis dis parturient montes nascetur ridiculus mus,2017-06-08 11:00:19,3
163,163,65,fusce posuere felis sed lacus morbi sem mauris laoreet ut rhoncus aliquet pulvinar,2017-12-05 02:33:32,8
164,164,28,sed sagittis nam congue risus semper porta volutpat quam pede lobortis ligula sit amet eleifend pede libero quis,2017-02-24 20:22:11,8
165,165,15,eu nibh quisque id justo sit amet sapien dignissim vestibulum vestibulum ante ipsum,2017-11-17 01:45:52,7
166,166,31,vestibulum velit id pretium iaculis diam erat fermentum justo nec condimentum neque sapien placerat ante nulla justo aliquam,2017-08-22 17:27:28,5
167,167,72,dictumst etiam faucibus cursus urna ut tellus nulla ut erat,2017-11-09 14:15:04,2
168,168,92,platea dictumst morbi vestibulum velit id pretium iaculis diam erat fermentum justo nec condimentum neque sapien,2018-01-10 08:41:31,7
169,169,28,tellus in sagittis dui vel nisl duis ac nibh fusce lacus purus aliquet at feugiat,2017-09-02 18:31:06,6
170,170,38,fringilla rhoncus mauris enim leo rhoncus sed vestibulum sit amet,2018-02-03 13:26:19,5
171,171,56,sem duis aliquam convallis nunc proin at turpis a pede posuere nonummy integer non velit donec,2017-07-30 02:34:58,1
172,172,43,id nulla ultrices aliquet maecenas leo odio condimentum id luctus nec molestie sed justo pellentesque,2017-07-13 14:02:48,5
173,173,77,quis orci eget orci vehicula condimentum curabitur in libero ut,2017-07-12 12:24:34,6
174,174,45,semper porta volutpat quam pede lobortis ligula sit amet eleifend,2017-02-08 05:30:33,7
175,175,28,odio cras mi pede malesuada in imperdiet et commodo vulputate justo in blandit,2017-05-21 17:22:47,1
176,176,93,id massa id nisl venenatis lacinia aenean sit amet justo,2017-06-21 06:13:10,8
177,177,87,vestibulum eget vulputate ut ultrices vel augue vestibulum ante ipsum primis in faucibus orci luctus et ultrices,2017-07-12 15:44:28,6
178,178,26,molestie nibh in lectus pellentesque at nulla suspendisse potenti cras in purus eu magna vulputate luctus cum sociis natoque,2017-04-20 15:49:28,3
179,179,83,ultrices phasellus id sapien in sapien iaculis congue vivamus metus arcu adipiscing molestie hendrerit at vulputate,2017-09-08 17:44:52,2
180,180,78,nunc nisl duis bibendum felis sed interdum venenatis turpis enim blandit mi in porttitor,2017-11-10 13:25:45,2
181,181,78,cum sociis natoque penatibus et magnis dis parturient montes nascetur ridiculus mus etiam vel,2017-07-25 19:18:24,8
182,182,90,pede justo lacinia eget tincidunt eget tempus vel pede morbi porttitor lorem id ligula suspendisse ornare,2017-06-15 13:54:09,4
183,183,6,metus aenean fermentum donec ut mauris eget massa tempor convallis nulla neque libero convallis,2017-11-03 20:27:30,1
184,184,16,justo in hac habitasse platea dictumst etiam faucibus cursus urna,2017-09-12 04:07:02,9
185,185,26,pede posuere nonummy integer non velit donec diam neque vestibulum eget vulputate ut ultrices vel augue vestibulum ante ipsum primis,2017-05-24 05:12:15,9
186,186,5,vulputate justo in blandit ultrices enim lorem ipsum dolor sit amet,2018-01-15 18:06:21,2
187,187,48,ante nulla justo aliquam quis turpis eget elit sodales scelerisque mauris sit amet,2018-01-07 01:15:57,3
188,188,15,vulputate ut ultrices vel augue vestibulum ante ipsum primis in,2017-12-12 07:24:30,1
189,189,21,congue elementum in hac habitasse platea dictumst morbi vestibulum velit id pretium iaculis diam erat,2017-09-07 02:43:28,4
190,190,58,non sodales sed tincidunt eu felis fusce posuere felis sed lacus morbi sem mauris laoreet ut rhoncus aliquet pulvinar sed,2017-04-09 18:46:01,1
191,191,34,sapien a libero nam dui proin leo odio porttitor id consequat in consequat ut nulla sed accumsan felis,2017-05-20 04:16:46,7
192,192,69,nunc proin at turpis a pede posuere nonummy integer non velit donec diam neque vestibulum eget vulputate ut,2017-07-18 10:10:47,1
193,193,60,eget tincidunt eget tempus vel pede morbi porttitor lorem id ligula,2017-07-09 00:40:19,1
194,194,13,vestibulum ante ipsum primis in faucibus orci luctus et ultrices,2017-03-29 06:11:53,2
195,195,86,sed lacus morbi sem mauris laoreet ut rhoncus aliquet pulvinar sed nisl nunc rhoncus dui,2018-02-06 16:00:29,4
196,196,31,molestie sed justo pellentesque viverra pede ac diam cras pellentesque volutpat dui maecenas tristique est et tempus semper est,2017-07-06 13:55:49,9
197,197,13,sit amet justo morbi ut odio cras mi pede malesuada in imperdiet et commodo vulputate justo in blandit ultrices,2017-12-10 15:16:08,5
198,198,20,in blandit ultrices enim lorem ipsum dolor sit amet consectetuer adipiscing elit proin interdum mauris non,2017-07-12 06:31:40,4
199,199,8,massa tempor convallis nulla neque libero convallis eget eleifend luctus ultricies eu nibh quisque id justo sit,2017-04-29 08:34:05,1
200,200,40,in quis justo maecenas rhoncus aliquam lacus morbi quis tortor id nulla ultrices aliquet maecenas leo odio condimentum id luctus,2018-01-04 13:03:04,1
201,201,64,amet justo morbi ut odio cras mi pede malesuada in imperdiet et commodo vulputate justo,2017-11-15 14:13:31,8
202,202,27,ultrices posuere cubilia curae mauris viverra diam vitae quam suspendisse potenti nullam porttitor lacus at turpis donec posuere metus vitae,2017-04-21 06:25:29,1
203,203,63,lectus aliquam sit amet diam in magna bibendum imperdiet nullam,2017-12-05 17:59:27,5
204,204,97,faucibus orci luctus et ultrices posuere cubilia curae duis faucibus accumsan odio curabitur convallis duis consequat,2018-01-23 18:02:30,7
205,205,17,ipsum primis in faucibus orci luctus et ultrices posuere cubilia curae mauris viverra diam vitae quam,2017-11-05 14:41:54,1
